RecipeId,Name,AuthorId,AuthorName,CookTime,PrepTime,TotalTime,DatePublished,Description,Images,RecipeCategory,Keywords,RecipeIngredientQuantities,RecipeIngredientParts,AggregatedRating,ReviewCount,Calories,FatContent,SaturatedFatContent,CholesterolContent,SodiumContent,CarbohydrateContent,FiberContent,SugarContent,ProteinContent,RecipeServings,RecipeYield,RecipeInstructions
2541,Oriental Style One-Dish Dinner,1533,Dancer,,PT0S,PT0S,1999-10-24T12:48:00Z,"Oriental Style One-Dish Dinner  For entertaining, make this in your fanciest skillet or flameproof casserole to take right to the table from the stove.",character(0),Low Cholesterol,"c(""< 15 Mins"", ""Oven"")","c(""1"", ""2"", ""2"", ""1"", ""8"", ""6"", ""1"", ""1/3"", ""1 1/2"", ""2"", ""1"", ""1/2"", ""1"", NA, ""4"")","c(""ground pork"", ""Chinese cabbage"", ""cabbage"", ""carrots"", ""onion"", ""mushrooms"", ""water chestnuts"", ""soy sauce"", ""short-grain rice"", ""zucchini"", ""asparagus"", ""salt"", ""pepper"", ""green onions"")",5,1,467.6,17.7,6.4,56.9,1466.8,54.1,4.6,6.1,22.8,6,,"c(""Lightly oil wok or skillet; add pork and stir-fry until meat is no longer pink."", ""Stir in cabbage, carrots, onion, mushrooms, water chestnuts and ginger; stir-fry for 2 minutes."", ""Mix in soy sauce, then rice; stir gently."", ""Pour in stock."", ""Cover tightly and simmer about 20 to 25 minutes until liquid is almost absorbed."", ""Stir in zucchini and asparagus; continue to cook about 5 minutes longer."", ""Season with salt, and pepper to  taste. Serve garnished with green onions."")"
2542,New England Fish Chowder,1533,Dancer,,PT0S,PT0S,1999-10-24T12:50:00Z,Make and share this New England Fish Chowder recipe from Food.com.,character(0),Chowders,"c(""Healthy"", ""< 15 Mins"")","c(""1"", ""2"", ""1/2"", ""1"", ""2"", ""3/4"", ""1"")","c(""bacon"", ""onion"", ""potato"", ""salt"", ""pepper"")",3.5,2,167.3,4.7,2.1,51.7,411.6,9.6,0.8,4.9,20.8,6,,"c(""Cut fillets into 1/2 - 1 inch cubes."", ""Fry the bacon until it is crisp."", ""Add the onions and brown them slightly."", ""Add the potatoes, and water to just cover, and cook for 10 minutes or until the potatoes are slightly tender."", ""Add the fish and cook until it flakes easily with a fork."", ""Add the milk and seasonings and reheat. Serve immediately with chopped parsley sprinkled over the top."")"
2543,Tuna Noodle Casserole Delight,1533,Dancer,PT50M,PT0S,PT50M,1999-10-24T12:52:00Z,Make and share this Tuna Noodle Casserole Delight recipe from Food.com.,"c(""https://img.sndimg.com/food/image/upload/w_555,h_416,c_fit,fl_progressive,q_95/v1/img/recipes/25/43/pic0FaTsR.jpg"", ""https://img.sndimg.com/food/image/upload/w_555,h_416,c_fit,fl_progressive,q_95/v1/img/recipes/25/43/picqmhLoF.jpg"")",Tuna,"c(""< 60 Mins"", ""Oven"")","c(""4"", ""2"", ""1"", ""1/2"", ""10 3/4"", ""6"", ""2"", ""1/4"")","c(""water"", ""salt"", ""skim milk"", ""tuna in water"", ""frozen green peas"")",4.5,6,120.3,1.4,0.3,12.9,622.6,14.3,4.1,4.5,12.7,6,,"c(""Preheat oven to 350."", ""Prepare a 2-quart casserole dish with cooking spray; set aside. Heat water to boiling."", ""Add noodles and salt. Boil for 9 minutes and drain."", ""Add milk to soup and mix well."", ""Arrange half of noodles, half of tuna, half of peas, and half of soup mixture in layers in prepared dish."", ""Repeat layers."", ""Sprinkle bread crumbs on top."", ""Bake for 30 minutes."")"
2544,Pumpkin Spice Cake,1533,Dancer,,PT0S,PT0S,1999-10-24T12:53:00Z,Make and share this Pumpkin Spice Cake recipe from Food.com.,character(0),Dessert,"c(""< 15 Mins"", ""For Large Groups"", ""Oven"")","c(""1/4"", ""1 3/4"", ""1/2"", NA, ""1/2"", ""1"", ""1"", ""1"", ""1 1/2"", ""1 1/2"", ""2"", ""2"", ""1"", ""1/4"", ""1 1/4"")","c(""margarine"", ""granulated sugar"", ""applesauce"", ""egg substitute"", ""low-fat buttermilk"", ""pumpkin puree"", ""orange, rind of"", ""vanilla"", ""all-purpose flour"", ""whole wheat flour"", ""cinnamon"", ""baking soda"", ""raisins"", ""icing sugar"")",,,242.7,3.4,0.7,0.3,202.8,51.9,2.2,29.9,3.5,16,,"c(""Beat sugar with margarine, using electric mixer."", ""Add egg, beating until light.  Beat in buttermilk, pumpkin, orange rind and vanilla."", ""Combine flours, cinnamon,  baking soda and raisins."", ""Stir into pumpkin mixture until combined."", ""Bake in  lightly-greased and floured 10-inch Bundt pan at 325 degrees for 60 to 65  minutes or until toothpick inserted in centre comes out clean."", ""Cool 20 minutes  and remove from pan."", ""Glaze: Blend icing sugar with orange juice. Drizzle over  cooled cake.""
)"
2545,Stuffed Zucchini,1629,Joy Boss,PT40M,PT15M,PT55M,1999-10-23T13:48:00Z,Make and share this Stuffed Zucchini recipe from Food.com.,"c(""https://img.sndimg.com/food/image/upload/w_555,h_416,c_fit,fl_progressive,q_95/v1/img/recipes/25/45/picluTm47.jpg"", ""https://img.sndimg.com/food/image/upload/w_555,h_416,c_fit,fl_progressive,q_95/v1/img/recipes/25/45/01504817212.jpeg"", ""https://img.sndimg.com/food/image/upload/w_555,h_416,c_fit,fl_progressive,q_95/v1/img/recipes/25/45/01491064995.jpeg"", ""https://img.sndimg.com/food/image/upload/w_555,h_416,c_fit,fl_progressive,q_95/v1/img/recipes/25/45/01472058445.jpeg"", ""https://img.sndimg.com/food/image/upload/w_555,h_416,c_fit,fl_progressive,q_95/v1/img/recipes/25/45/picc5wtHv.jpg"", 
""https://img.sndimg.com/food/image/upload/w_555,h_416,c_fit,fl_progressive,q_95/v1/img/recipes/25/45/pic9U8EqV.jpg"")",Vegetable,"c(""Low Protein"", ""Low Cholesterol"", ""Summer"", ""< 60 Mins"", ""Oven"")","c(""7"", ""1/2"", ""1/4"", ""1/2"", ""1"", ""1"", ""1"", ""1/2"", ""3/4"", ""1/8"", NA)","c(""fresh zucchini"", ""onion"", ""olive oil"", ""fresh mushrooms"", ""garlic clove"", ""cream cheese"", ""egg"", ""parmesan cheese"", ""fresh parsley"", ""pepper"", ""parmesan cheese"")",5,49,192.9,15.3,5,46.2,178.7,8.7,2.4,6,7.2,7,,"c(""Slice zucchini in half lengthwise.  Scoop out insides leaving about 1/4-in shell."", ""Finely chop zucchini pulp; set aside.  Saute onion in oil in large heavy skillet.  Add mushrooms, garlic and reserved chopped zucchini; cook over medium heat until most of moisture evaporates."", ""Add cream cheese, egg, Parmesan, parsley, and pepper."", ""Mix well; cook for about 10 minutes."", ""Cool filling slightly and fill zucchini shells."", ""Sprinkle with additional Parmesan cheese.  Place on jelly roll pans; bake for 30 minutes at 350°F until bubbly and golden brown on top.""
)"
2546,Peanut Butter Cream Pie,1867,Amanda McComb,,PT15M,PT15M,1999-10-23T19:02:00Z,Make and share this Peanut Butter Cream Pie recipe from Food.com.,character(0),Pie,"c(""Dessert"", ""Fruit"", ""Nuts"", ""Kid Friendly"", ""< 15 Mins"", ""Easy"")","c(""1"", ""8"", ""1"", ""3/4"", ""2"", ""1"", ""3"", ""2"")","c(""cream cheese"", ""sweetened condensed milk"", ""peanut butter"", ""vanilla"", ""heavy cream"", ""heavy cream"")",,,955.9,67.5,30.1,128.9,622,73.4,3,54.8,20.1,,,"c(""FILLING:  Beat cream cheese - beat in condensed milk, peanut butter and vanilla."", ""Whip heavy cream and fold into cream cheese mixture."", ""Melt together chopped milk chocolate and  heavy cream."", ""Drizzle over top."", ""Refrigerate until ready to serve."")"
2549,Good Ol' Grits Pie,1860,The George Family,PT45M,PT15M,PT1H,1999-10-23T21:52:00Z,Make and share this Good Ol' Grits Pie recipe from Food.com.,character(0),Pie,"c(""Dessert"", ""< 60 Mins"", ""Oven"")","c(""1"", ""1"", ""2"", ""2"", ""4"", ""2"", ""1"", ""1"", ""1"")","c(""quick-cooking grits"", ""brown sugar"", ""flour"", ""eggs"", ""milk"", ""butter"", ""margarine"", ""pure vanilla extract"", ""white vinegar"")",5,1,347.6,12.4,4.4,55.2,176.8,54.2,0.7,27,5.1,8,,"c(""Preheat the oven to 350 degrees F."", ""In a bowl, combine the grits, brown sugar,  flour, and eggs."", ""Blend well, then stir in the milk and butter or margarine. Add  the vanilla and vinegar, and blend well."", ""Pour the mixture into the pie shell and bake for 35 to 40 minutes,  or until the center is just set. Let cool briefly, then serve while still warm."", ""Serve warm by itself or topped with ice cream."")"
2550,Sweet Tamales,1534,Tonkcats,,PT0S,PT0S,1999-10-23T21:58:00Z,Make and share this Sweet Tamales recipe from Food.com.,character(0),Mexican,"c(""Low Protein"", ""< 15 Mins"")","c(""32"", ""1"", ""1"", ""3"", ""1 1/2"", ""1/2"", ""1 1/2"", ""1 1/2"", ""1/4"", ""2/3"", ""2/3"")","c(""salt"", ""masa harina mix"", ""water"", ""brown sugar"", ""baking powder"", ""cinnamon"", ""nutmeg"", ""pecans"", ""raisins"")",,,96.2,8.1,2.7,6.1,91.3,6.2,0.4,5.2,0.3,,32 tamales,"c(""Soak husks according to directions in Basic Tamales."", ""For tamale dough:  Beat lard and salt until fluffy."", ""Slowly beat in masa mix alternately  with water until very light and fluffy."", ""Add brown sugar, baking powder, cinnamon and nutmeg, mixing until well blended."", ""To assemble tamales: Drain corn husks; pat dry."", ""Spread 2 tablespoons dough on center of husks, forming a 3 x 2-inch rectangle and spreading completely to right edge.  Spoon 1 teaspoon each pecans and raisins  lengthwise down center of rectangle. To enclose and steam tamales, proceed according to directions in Basic Tamales.""
)"
2551,Shrimp Dip,1869,dianna odonoughue,,PT0S,PT0S,1999-10-24T06:46:00Z,Make and share this Shrimp Dip recipe from Food.com.,character(0),< 15 Mins,,"c(""1"", ""1"", ""8"", ""2"", ""1"", ""1"", ""1"")","c(""gelatin"", ""cream cheese"", ""shrimp"", ""mayonnaise"", ""celery"", ""onion"")",5,7,1978.9,158.3,55.9,311,3673.7,124,8,55.5,28.9,1,,"c(""Heat soup, dissolve gelatin stirring constantly until dissolved."", ""Let cool  slightly, put in mixer with cream cheese and mayonnaise and mix."", ""By hand add  shrimp, celery and onion and mix."", ""Serve with crackers. May be frozen."", ""Grease  container and pour into a mold to set in refrigerator, and then unmold to serve."")"
2553,Low-Fat Creamy Macaroni & Cheese,1533,Dancer,,PT0S,PT0S,1999-10-25T05:29:00Z,Make and share this Low-Fat Creamy Macaroni & Cheese recipe from Food.com.,character(0),Cheese,"c(""Kid Friendly"", ""< 15 Mins"", ""Oven"")","c(""2"", ""4"", ""1"", ""3/4"", ""1/3"", ""1/4"", ""1"", ""1"", ""1"", ""1"", ""1/4"", ""1"", ""2"", ""1/2"")","c(""elbow macaroni"", ""reduced-fat monterey jack cheese"", ""nonfat cottage cheese"", ""nonfat sour cream"", ""skim milk"", ""onion"", ""light margarine"", ""dry mustard"", ""black pepper"", ""paprika"")",4.5,4,334.5,3.8,1.9,13.2,357.7,52,2.1,6.3,21.8,4,,"c(""Coat a two-quart casserole dish with non-stick spray."", ""Cook macaroni according to package directions."", ""Drain macaroni, reserving two tablespoons cooking water."", ""Toss macaroni with reserved cooking water, cheeses, sour cream, milk, onions, egg white, margarine, cheese-flavored granules, mustard and peppers until well combined."", ""Spoon into casserole dish."", ""Sprinkle with cracker crumbs and paprika."", ""Cover."", ""Bake casserole at 350 degrees for 25 minutes."", ""Uncover and bake until golden brown an d bubbly, about five minutes.""
)"
2554,Gold Medal Caramel Bars,1533,Dancer,PT25M,PT0S,PT25M,1999-10-24T21:54:00Z,Make and share this Gold Medal Caramel Bars recipe from Food.com.,character(0),Bar Cookie,"c(""Dessert"", ""Cookie & Brownie"", ""< 30 Mins"", ""Oven"", ""Easy"")","c(""1"", ""1"", ""12 1/4"", ""2"")",character(0),3,2,4.2,0.3,0.2,0,0.1,0.6,0.1,0.5,0,,24 bars,"c(""Preheat oven to 350°."", ""Prepare a 9 x 13 pan with cooking spray; set aside. In a mixing bowl, combine cake mix and sweetened condensed milk."", ""Batter will be thick."", ""Press 2/3 of batter into prepared pan."", ""Bake for 8 minutes."", ""Remove from oven and pour caramel topping over cake. Sprinkle with chocolate chips."", ""Crumble remaining batter over top."", ""Bake for 17 minutes more or until top is dry to the touch."", ""Cool."")"
2555,Cilantro Lime Soup,1533,Dancer,,PT0S,PT0S,1999-10-24T21:54:00Z,Make and share this Cilantro Lime Soup recipe from Food.com.,character(0),Chicken Breast,"c(""Chicken"", ""Poultry"", ""Meat"", ""Low Cholesterol"", ""< 15 Mins"")","c(""1"", ""1"", ""1/2"", ""5"", ""1"", ""1/4"", ""1/2"", ""1"", ""2"", ""1/4"", ""1"", NA, NA)","c(""dried chipotle chiles"", ""canned chipotle chile puree"", ""tomatoes"", ""chicken breast"", ""chicken broth"", ""chili powder"", ""cilantro"", ""cilantro"", ""corn"", ""garlic"", ""lime juice"", ""onion"", ""sour cream"", ""tortilla chip strips"")",5,3,223,8,2.2,36.3,1021.6,19.1,3,5,20.4,4,,"c(""Heat broth in medium pot. Add onion, garlic, chili powder, tomatoes, bunch cilantro and chile. Simmer for 15 minutes."", ""Add chicken and simmer until cooked (about 10 minutes). Discard bunch cilantro."", ""Add corn and cook 2-3 minutes."", ""Add chopped cilantro and lime juice. Garnish with sour cream and baked tortilla strips (cut corn tortillas in strips, spray with cooking spray, bake in 350 degree oven until crisp)."")"
2556,Whipped Potatoes,1533,Dancer,,PT0S,PT0S,1999-10-24T21:55:00Z,Make and share this Whipped Potatoes recipe from Food.com.,character(0),Potato,"c(""Vegetable"", ""Low Protein"", ""Low Cholesterol"", ""Healthy"", ""< 15 Mins"")","c(""2 1/2"", ""1/4"", ""2"", ""2"", ""1/2"", ""1/4"", NA, ""1"")","c(""potatoes"", ""skim milk"", ""nonfat sour cream"", ""salt"", ""fresh black pepper"", ""paprika"", ""fresh parsley leaves"")",,,155.2,0.3,0.1,0.7,215.4,34.5,4.2,1.9,4.5,6,,"c(""..Place the potatoes in a five quart pan."", ""Add cold water to 1 inch above the potatoes."", ""Place the pan over high heat and bring the water to a boil."", ""Reduce the heat and simmer for about 20 minutes."", ""When potatoes pierce easily with a fork, remove from the pan from the stove and drain."", ""..Place the drained potatoes into the large bowl of an electric mixer."", ""At low speed, begin to break up the potatoes."", ""As the potatoes break up, slowly raise the speed of the mixer to medium."", ""Add the milk, Butter Buds, nonfat sour cream, salt and pepper and mix until smooth."", 
""Spoon the whipped potatoes into a warmed serving bowl and dust with the papri ka and parsley."")"
2558,Pump Cake,1572,Ed Paulhus,,PT0S,PT0S,1999-10-25T05:31:00Z,"This type of dessert was developed in the south.  It was often called a ""dump"" cake.  We prefer Pump cake as it will pump you up with carbohydrates.  (Thanks to GramaCar for filling in the missing steps!)",character(0),Dessert,"c(""Low Protein"", ""< 15 Mins"", ""For Large Groups"", ""Oven"", ""Easy"")","c(""1"", ""1"", ""1"", ""5"")","c(""light cherry pie filling"", ""mandarin oranges"", ""unsalted butter"")",,,134.2,6.6,3,10.2,145.8,18.9,1.2,12,1.5,15,,"c(""First place the cherries, and mandarin oranges (not drained) into a buttered 9 1/2 x 13 inch cakepan.  ,"", ""Sprinkle the dry cake mix over the top of the fruit"", ""Put pats of the butter on the top of the dry cake mix."", ""Place in a 350 degree oven for approx 50 to 60 minutes."")"
2559,Rice Pudding with Fresh Fruit,1572,Ed Paulhus,,PT0S,PT0S,1999-10-25T05:35:00Z,Make and share this Rice Pudding with Fresh Fruit recipe from Food.com.,character(0),Dessert,"c(""Short Grain Rice"", ""Rice"", ""Pears"", ""Fruit"", ""< 15 Mins"")","c(""1/2"", ""3"", ""1/4"", ""1/4"", ""1"", ""1"", ""2"", NA, ""1"")","c(""short-grain rice"", ""milk"", ""sugar"", ""salt"", ""vanilla extract"", ""Pernod"", ""pastis"", ""pears"", ""raspberries"", ""anise seed"")",,,1231.7,28.1,16.9,102.5,945.1,216.1,13.4,83,32.1,1,,"c(""In a saucepan, combine rice, milk, sugar, and salt. Cook over medium heat until mixture begins to bubble. Reduce heat and cover."", ""Cook 1 hour, stirring occasionally."", ""Remove from heat.  Add vanilla and Pernod."", ""Cool, then refrigerate at least 3 hours."", ""Halve pears lengthwise, slice thinly, and spread out into a fan shape.   Place pear and rice pudding on plates, and garnish with raspberries and anise seeds."")"
2560,Confetti Coleslaw,1572,Ed Paulhus,,PT15M,PT15M,1999-10-25T05:33:00Z,"As you celebrate your winning time, your oxygen consumption  may have hit an all-time high.  This side dish filled with antiozidants is an essential component of your victory meal.","""https://img.sndimg.com/food/image/upload/w_555,h_416,c_fit,fl_progressive,q_95/v1/img/recipes/25/60/picBa36Cc.jpg""",Summer,"c(""< 15 Mins"", ""Easy"")","c(""1/4"", ""1/4"", ""1 1/2"", ""1 1/2"", ""1 1/2"", ""3"", ""1/2"")","c(""low-fat mayonnaise"", ""plain nonfat yogurt"", ""fresh lemon juice"", ""sugar"", ""herb seasoning mix"", ""red cabbage"", ""green cabbage"", ""carrot"")",4.5,3,203.7,0.7,0.1,1.2,148.4,46.7,6.3,35.2,7.2,,1 batch,"""In a large bowl, combine all the ingredients and serve."""
2561,Hawaiian Ambrosia Salad,1534,Tonkcats,PT24H,PT10M,PT24H10M,1999-10-26T10:03:00Z,Make and share this Hawaiian Ambrosia Salad recipe from Food.com.,"c(""https://img.sndimg.com/food/image/upload/w_555,h_416,c_fit,fl_progressive,q_95/v1/img/recipes/25/61/picSllOc8.jpg"", ""https://img.sndimg.com/food/image/upload/w_555,h_416,c_fit,fl_progressive,q_95/v1/img/recipes/25/61/picnfnvzG.jpg"", ""https://img.sndimg.com/food/image/upload/w_555,h_416,c_fit,fl_progressive,q_95/v1/img/recipes/25/61/picBTbvgW.jpg"")",Candy,"c(""Dessert"", ""Pineapple"", ""Tropical Fruits"", ""Fruit"", ""Low Protein"", ""Healthy"", ""Easy"")","c(""10"", ""12"", ""20"", ""1 1/2"", ""8"")","c(""maraschino cherries"", ""mandarin oranges"", ""pineapple chunks"", ""mini marshmallows"", ""sour cream"")",5,16,289.8,8.7,5.2,17.5,35.1,54.1,3.3,45.2,2.4,6,,"c(""Drain fruit well."", ""Mix all ingredients together."", ""Refrigerate for 24 hours."", ""Be sure fruit is well drained or  Ambrosia will be mushy."")"
2562,Ambrosia Pie,1534,Tonkcats,,PT10M,PT10M,1999-10-26T10:03:00Z,Make and share this Ambrosia Pie recipe from Food.com.,character(0),Pie,"c(""Dessert"", ""Pineapple"", ""Tropical Fruits"", ""Fruit"", ""Low Protein"", ""< 15 Mins"", ""Easy"")","c(""1"", ""2"", ""1"", ""1"", NA)","c(""sour cream"", ""miniature marshmallows"", ""crushed pineapple"", ""chocolate curls"")",,,456.3,24.7,11.2,30.8,279.1,57.4,1.4,38.6,4.6,,,"c(""Combine first three ingredients and pour into the prepared Crust."", ""Sprinkle with Chocolate."", ""Refrigerate"", ""So easy but so good."")"
2563,Japanese Fruit Pie,193853,MirandaLee,PT40M,PT10M,PT50M,1999-10-25T05:40:00Z,Make and share this Japanese Fruit Pie recipe from Food.com.,character(0),Pie,"c(""Dessert"", ""Fruit"", ""Asian"", ""< 60 Mins"", ""Oven"")","c(""1/2"", ""2"", ""3/4"", ""1"", ""1/2"", ""1/2"", ""1/2"", ""1"")","c(""margarine"", ""eggs"", ""sugar"", ""cider vinegar"", ""raisins"", ""pecans"", ""coconut"")",4.5,6,529.6,35,10.6,54.6,322.3,52.2,3.3,34.1,5.4,6,,"c(""Stir ingredients together in order given."", ""Pour into formed 9\"" pie shell."", ""Bake at 325 for 40  minutes."", ""To double the recipe, double all ingredients except margarine.                  - - - - - - - - - - - - - - - - - -  NOTES : To double recipe, double all ingredients except butter."", ""Do not use less than the  amount listed for one pie, though."")"
2564,Nuts & Dried Fruit Mooncake,123897,Vnut-Beyond Redempt,,PT0S,PT0S,1999-10-25T05:37:00Z,Please remember that these mooncake need to made with a mooncake mold.   Nuts & Dried Fruit Mooncake - Traditional Taiwan Style  Pastry Crust,character(0),Dessert,"c(""Fruit"", ""Nuts"", ""< 15 Mins"", ""Oven"")","c(""1"", ""100"", ""100"", ""1/2"", ""100"", ""60"", ""450"", ""100"", ""200"", ""2"", ""2"", ""2"", ""1"", ""1"", ""50"", ""50"", ""60"", ""80"", ""30"", ""30"", ""20"", ""1"", ""2"", ""1/2"", ""1"", ""1"")","c(""bread flour"", ""cake flour"", ""baking powder"", ""sugar water"", ""black dates"", ""water"", ""white grape wine"", ""wine"", ""flour"", ""sugar"", ""walnuts"", ""pine nuts"", ""raisins"", ""cooking wine"", ""milk"")",,,4832.9,278.4,40.9,332.4,1356.3,522.4,47.6,168.6,85.3,1,,"c(""Fillings: (A) Red Bean Filling 450g red bean paste (B) Dried Fruit & Nuts Filling:   100g pitted black dates 200 cc  water 2 Tbsp white grape wine 2 Tbsp wine 2 Tbsp Sugar Syrup* 1 Tbsp flour  1 Tbsp glutinous flour 50g almond 50g sugar 60g toasted sesame 80g walnut  30g pine nuts 30g raisins 20g oil  Light Color Pastry Shine Oil 1 egg yolk 2 tsp cooking wine ,  1/2 tsp milk Dark Color Pastry Shine Oil 1 egg yolk 2 tsp cooking wine 1 sugar syrup,  heated  (like caramel sort ) Make filling."", ""Cook the dates with the 200 cc water on low heat until all the  water is absorbed."", 
""Add wines, syrup and flours."", ""Cook to thicken."", ""Remove the  dates and mash ."", ""Cut raisins and  other fruit and nuts into thin stripes or  little pieces ."", ""Mix with the mashed dates ."", ""Shape into dough with hands."", ""Let  cool."", ""Divide into 30 g balls."", ""Make Pastry crust. Mix both type of flour and baking powder then sift and place  it into a large bowl."", ""Dig a hole in the middle of dough ."", ""Mix the sugar-water  and oil and pour it into the hole. Slowly mix well."", ""Then knead till the dough no longer sticky to hand and is shiny."", 
""Don't use too much force to knead."", ""Divide  dough into 12 portion ."", ""Each portion should weight 25g."", ""On each piece of dough  place the filling--either the red bean paste or the dried fruit/nuts filling."", ""Sprinkle flour in mooncake mold."", ""Place the mooncake into the mold and press into shape. Get rid of the extra flour on the mold."", ""Then brush the top  with the  shine oil."", ""Bake at 190C degree for 15 minutes."", ""** For red bean paste mooncake the crust is same as the  above one.   ** If no mold shape in round with hand    Cantonese Style Mooncake ( Red Bean Paste with egg yolk )   Pastry :  (A)2C cake flour , 1T milk powder , 2/5C fine sugar ,  1/8t  baking powder       (B ) 1/3C oil , 1/2t salt , 1/3C honey , 1 egg yolk   Filling: 900g Red bean paste , 20 Salted Egg Yolks   Sieve ingredient (A) on the flour, dig a hole in the middle ,  add  the   (B)  ingredients."", 
""Stir them and knead into a very soft  dough."", ""Cut into 10 portions."", ""Divide the red bean paste into 10 portions , wrap 2  egg yolks  into each of the  portion.(before this the yolk may be dip with wine   and bake in oven for 5  minutes). Wrap each of the (2) into each of the (1). Press into the  mooncake  mold , tip it out of the mold, apply beaten egg on the  surface. Bake in oven  bake for 20 minutes at 180C degree."")"
2566,Chicken Noodle Soup,1534,Tonkcats,PT52M,PT10M,PT1H2M,1999-10-26T10:03:00Z,Make and share this Chicken Noodle Soup recipe from Food.com.,character(0),Chicken,"c(""Poultry"", ""Meat"", ""Weeknight"", ""< 4 Hours"", ""Easy"")","c(""1"", ""1"", ""1"", ""1"")","c(""water"", ""chicken"")",3,5,83.8,5.9,1.7,29.2,29.5,0,0,0,7.2,4,,"c(""Combine all ingredients in a saucepan and bring to a  boil."", ""Simmer 5 to 7 minutes over low heat."", ""CHICKEN NOODLE SOUP  1 lb. (about) chicken breasts  2 (13 3/4 oz.) cans chicken  broth  1/2 cup each chopped onion,  carrots and celery  1 cup water  medium egg noodles"", ""In large saucepan combine all ingredients except noodles. Simmer, covered, 30 minutes."", ""Remove chicken and cut off  bones and cut into small pieces."", ""Add to soup."", ""Stir in noodles."", ""Simmer, covered, 15 minutes."")"
2567,Chicken Soup II,1534,Tonkcats,PT30M,PT30M,PT1H,1999-10-26T10:03:00Z,Make and share this Chicken Soup II recipe from Food.com.,character(0),Chicken,"c(""Poultry"", ""Meat"", ""Low Cholesterol"", ""Healthy"", ""< 60 Mins"", ""Easy"")","c(""4"", ""4"", ""1"", ""1"", ""1"", ""4"", ""2"", ""3"", ""1"", ""1"", ""1"", ""1"", NA)","c(""chicken breasts"", ""potatoes"", ""tomatoes"", ""frozen okra"", ""white corn"", ""carrots"", ""onions"", ""celery"", ""rice"", ""macaroni"")",,,733,14.2,3.9,65.7,497.6,116.8,12.8,11.8,37.6,6,1 batch,"c(""Place chicken in a stockpot and cover with water."", ""Boil chicken until it falls off the bone."", ""Remove bones and gristle."", ""Set aside."", ""Cook potatoes in fresh water until tender (not mushy)."", ""Rinse."", ""Cook carrots in broth until  tender."", ""Add remaining ingredients and cook at least another 30 minutes."")"
2569,Dreamsicle Salad,1534,Tonkcats,,PT0S,PT30M,1999-10-25T05:40:00Z,Make and share this Dreamsicle Salad recipe from Food.com.,character(0),Pineapple,"c(""Tropical Fruits"", ""Fruit"", ""Kid Friendly"", ""Roast"", ""< 30 Mins"", ""Oven"")","c(""2/3"", ""2/3"", ""2"", ""8"", ""1"", ""2"", NA, ""8"")","c(""sugar"", ""water"", ""apricot gelatin"", ""cream cheese"", ""pineapple"", ""apricots"", ""Cool Whip"")",,,295.9,17.1,11.7,31.2,99.9,35.5,1.4,32.7,2.8,,,"c(""Combine sugar and water and bring to a boil."", ""Add gelatin and set aside to cool."", ""In blender, combine cream cheese with pineapple and baby food and blend."", ""Mix together gelatin and cream cheese mixtures."", ""Fold in Cool Whip."", ""Pour into mold or Pyrex 9 x 13-inch pan and refrigerate until set."")"
2570,Curried Pumpkin Soup,1534,Tonkcats,PT35M,PT10M,PT45M,1999-10-26T10:03:00Z,"Curried Pumpkin Soup    This is a very tasty soup that keeps up to 3 days in the fridge, and  freezes well.",character(0),Low Protein,"c(""Low Cholesterol"", ""Healthy"", ""< 60 Mins"")","c(""4"", ""1"", ""1"", ""2"", ""1"", ""1"", ""1"", ""4"", ""1"", ""1"", NA)","c(""apples"", ""butter"", ""margarine"", ""onion"", ""garlic cloves"", ""curry powder"", ""cumin"", ""pumpkin puree"", ""chicken broth"", ""water"", ""white sugar"", ""sour cream"", ""yogurt"")",5,11,139.7,3.4,1.6,5.1,519.8,25.2,4,15.5,4.8,6,,"c(""Melt butter or margarine in a large saucepan over medium heat. Add onion,  garlic, curry, and cumin; saute, stirring often, until onion is soft and  fragrant. Stir in apples, pumpkin, broth, water, and sugar."", ""Bring to a boil,  stirring often."", ""Cover, and reduce heat to low."", ""Simmer for 25 minutes, stirring  occasionally."", ""Puree soup in a food processor or a blender."", ""Return soup to  saucepan; reheat, covered, over low heat. Ladle soup into bowls, and swirl a  little sour cream or yogurt in  the center of each bowl.""
)"
