RecipeId,Name,AuthorId,AuthorName,CookTime,PrepTime,TotalTime,DatePublished,Description,Images,RecipeCategory,Keywords,RecipeIngredientQuantities,RecipeIngredientParts,AggregatedRating,ReviewCount,Calories,FatContent,SaturatedFatContent,CholesterolContent,SodiumContent,CarbohydrateContent,FiberContent,SugarContent,ProteinContent,RecipeServings,RecipeYield,RecipeInstructions
2677,Yeast Biscuits,163272,Windchime,PT12M,PT2H,PT2H12M,1999-08-19T05:40:00Z,These biscuits work every time and are really good for making ham biscuits or other 'sandwiches'. They hold up well and yet are tender with a wonderful flavor. Prep time includes rest time.,"c(""https://img.sndimg.com/food/image/upload/w_555,h_416,c_fit,fl_progressive,q_95/v1/img/recipes/26/77/picqbs92Z.jpg"", ""https://img.sndimg.com/food/image/upload/v1/img/feed/2677/V3ugdIMOQRCP1AY9sY7Y_10213075074011936.jpg"", ""https://img.sndimg.com/food/image/upload/w_555,h_416,c_fit,fl_progressive,q_95/v1/img/recipes/26/77/rEIiQ6yeSG2HFVzssluu_40339245090.jpg"", ""https://img.sndimg.com/food/image/upload/w_555,h_416,c_fit,fl_progressive,q_95/v1/img/recipes/26/77/picDiLc9V.jpg"", ""https://img.sndimg.com/food/image/upload/v1/img/feed/2677/QzMsegvgSqeXLXuQXSp1_image.jpg"", 
""https://img.sndimg.com/food/image/upload/w_555,h_416,c_fit,fl_progressive,q_95/v1/img/recipes/26/77/picaPaH9a.jpg"", ""https://img.sndimg.com/food/image/upload/v1/img/feed/2677/Y9mhYrTzSjAcvjiUQqXw_IMG_1684.HEIC.jpe"", ""https://img.sndimg.com/food/image/upload/w_555,h_416,c_fit,fl_progressive,q_95/v1/img/recipes/26/77/49siFlaFQ9WI0YsfLcdU_20200429_133536.jpg"", ""https://img.sndimg.com/food/image/upload/v1/img/feed/2677/mDjT4sNQOmXEPCH9EETJ_20200429_133545.jpg"")",Yeast Breads,"c(""Breads"", ""For Large Groups"", ""Oven"", ""< 4 Hours"")","c(""1"", ""1/4"", ""2 1/2"", ""1"", ""1/2"", ""1"", ""2"", ""1/2"", ""1"")","c(""water"", ""flour"", ""baking powder"", ""baking soda"", ""salt"", ""sugar"", ""shortening"", ""buttermilk"")",5,64,142.5,6.8,1.7,0.6,224.3,17.6,0.7,2.4,2.8,16,16 biscuits,"c(""Dissolve yeast in water, set aside."", ""Mix dry ingredients in order given; cut in  shortening until the size of small Lima beans."", ""Stir in buttermilk and yeast mixture."", ""Cover bowl with towel and let sit until ready to use. (At least 1 hour, but it is fine if it sits for a couple hours.) Dough will be very sticky."", ""Scrape out onto well floured board."", ""Flip over and knead lightly (4-6 times)."", ""Roll out and cut with biscuit cutter."", ""Place on greased pan and let raise slightly (10-30  minutes)."", 
""Bake at 400 F until light brown, 10-12 minutes."")"
2678,Yoghurt Wholemeal Scones,1749,Pam Wood,,PT0S,PT0S,1999-08-09T21:52:00Z,Make and share this Yoghurt Wholemeal Scones recipe from Food.com.,character(0),Scones,"c(""Quick Breads"", ""Breads"", ""Healthy"", ""< 15 Mins"", ""Oven"", ""Easy"")","c(""225"", ""1/2"", ""1 1/2"", ""25"", ""150"")","c(""whole wheat flour"", ""salt"", ""baking powder"", ""margarine"", ""yoghurt"")",4,3,1038.6,30.7,8.3,19.9,2018,170.3,24,8.1,35.1,1,,"c(""Mix together flour, salt, and baking powder..Rub in margarine. Form into a stiff dough with the yoghurt. Turn onto a floured board and shape with the hands until 2 cm/3/4 inch thick."", ""Cut into rounds with a pastry cutter."", ""Place on a lightly greased baking tray and bake in a moderately hot oven,Gas 6, 400 F, 200 C, for 10 to 12 minutes."", ""Serve hot with butter."")"
2679,Nanna's Yorkshire Pudding,1556,Strawberry Girl,PT20M,PT5M,PT25M,1999-08-21T10:36:00Z,"These are my nanna's and mother's Yorkshire pudding recipes. I guess the problem with traditional recipes is that they are seldom very accurate. This does not  produce a &quot;popover&quot; style Yorkshire pudding like I have found in North American  restaurants. The result of the recipes below is the more traditional  style--slightly eggy, and &quot;fallen.&quot; My siblings and I MUCH prefer it this way.  Batter resting time not included in preparation time.",character(0),European,"c(""< 15 Mins"", ""Oven"", ""Easy"")","c(""2"", ""1/2"", ""2"", ""1"")","c(""flour"", ""milk"", ""eggs"")",5,7,127.5,8,3.8,81.3,43.5,9.2,0.3,0.1,4.4,6,1 batch,"c(""In a bowl combine flour and salt."", ""With a handheld mixer add the milk, in a stream, until smooth."", ""Add water and eggs and beat until combined well and bubbly."", ""Let stand, covered, at room temperature for 1 hour."", ""Preheat oven to 450°F"", ""Divide drippings among six muffin pan cups."", ""Heat the cups in the oven until almost smoking."", ""Beat batter until bubbly and divide among muffin cups."", ""Bake 10 minutes in lower third of the oven without opening the oven door."", ""Reduce oven temperature to 350 degrees F and continue to bake for another 10 minutes until puffed, crisp and golden brown."", 
""Serve immediately."", ""MUM'S YORKSHIRE PUDDING 1 cup flour 1 cup milk 2 eggs salt & pepper Put fat from roast into glass pie plate or use vegetable oil. (Be generous.) Mix listed ingredients together. Cook in 450F oven for 25 minutes."")"
2680,Yummy Vegetable Fritters,1750,Doreen Randal To,PT15M,PT15M,PT30M,1999-09-13T16:56:00Z,Make and share this Yummy Vegetable Fritters recipe from Food.com.,character(0),Vegetable,"""< 30 Mins""","c(""2"", ""2"", ""2"", ""1"", ""2"", ""1/2"", ""1"", ""4"", NA, ""1/2"", ""1/2"", ""1/2"")","c(""carrots"", ""potatoes"", ""courgettes"", ""onion"", ""garlic cloves"", ""whole kernel corn"", ""tomatoes"", ""fresh herbs"", ""cumin"", ""curry powder"", ""paprika"")",4,2,596.6,3.7,0.8,0,420.6,132.2,22.7,29,19.8,,1 batch,"c(""Batter:- 3 eggs 1 Tbsp flour 1 tsp baking powder oil for frying Squeeze all the excess moisture from the grated vegetables."", ""Mix together well the vegetables, herbs and spices."", ""Lightly beat the eggs and mix in the flour and baking powder."", ""Stir into the vegetables and let stand 30 minutes."", ""If there is any excess liquid on top, scoop it off with a spoon."", ""Heat oil in a frypan (about 1 Tbs) add large spoonfuls of the fritter mixture, allowing enough space to expand."", ""Don't flatten the fritters."", 
""Cover with a lid and cook around 10 minutes over a medium heat.  Turn and cook the other side, until golden."", ""Drain on absorbent paper."", ""Serve with chutneys of your favourite sauce. Cheers,  Doreen Doreen Randal,  Wanganui."", ""New Zealand."")"
2681,Zesty Beef and Bean Wedges,1552,Ron  Joyce Ripple S,,PT0S,PT0S,1999-09-10T04:58:00Z,Make and share this Zesty Beef and Bean Wedges recipe from Food.com.,character(0),Beans,"c(""Meat"", ""< 15 Mins"", ""Oven"")","c(""1"", ""1"", ""1"", ""1"", ""1/8"", ""4"", ""1/4"", NA)","c(""fresh lime juice"", ""pepper"", ""green onion"", ""lime wedge"")",5,1,290.9,22.7,8.7,80.5,77,0.8,0.2,0.2,19.6,4,,"c(""Heat oven to 375."", ""Combine beef, beans, mix, juice and pepper in large bowl,  mixing lightly but thoroughly."", ""Spread mixture evenly in 12-: pizza pan."", ""(Recipe can be prepared in a 13 x 9\"" baking pan).  Bake 15 minutes to medium  (160 degrees) doneness, until beef is not pink in center and juices show no pink color."", ""Sprinkle with cheese; continue baking 2 to 3 minutes or until cheese is  melted."", ""Sprinkle with green onions; cut into 8 wedges."", ""Garnish with lime  wedges if desired.""
)"
2682,Zucchini Bars,1548,Peggy Benisch,PT25M,PT10M,PT35M,1999-08-28T00:09:00Z,"This time of year it seems we all have extra-large zucchini, which makes great bread and stuff.  Here is a recipe to help you that is yummy for bars.  Hope you enjoy!","c(""https://img.sndimg.com/food/image/upload/w_555,h_416,c_fit,fl_progressive,q_95/v1/img/recipes/26/82/6cOSnZw0RyiwzEfcddPi_Zucchini%20Bar%202682.1.jpg"", ""https://img.sndimg.com/food/image/upload/w_555,h_416,c_fit,fl_progressive,q_95/v1/img/recipes/26/82/4YtRHFmYQIaNPNDYEqCp_Zucchini%20Bar%202682.2.jpg"", ""https://img.sndimg.com/food/image/upload/w_555,h_416,c_fit,fl_progressive,q_95/v1/img/recipes/26/82/sbav41hGQMO10YDYWxMj_Zucchini%20Bar%202682.3.jpg"")",Bar Cookie,"c(""Dessert"", ""Cookie & Brownie"", ""< 60 Mins"", ""Oven"", ""Easy"")","c(""3"", ""2"", ""1"", ""2"", ""3"", ""2 1/2"", ""1/4"", ""1"", ""2"", ""1/2"", ""1"", ""1"", ""2 1/2"", NA)","c(""eggs"", ""sugar"", ""canola oil"", ""zucchini"", ""vanilla"", ""flour"", ""baking powder"", ""salt"", ""baking soda"", ""oleo"", ""butter"", ""vanilla"", ""cream cheese"", ""powdered sugar"", ""milk"")",5,28,599.7,29.8,4.7,60.7,541.2,79.4,0.9,58.5,5.1,,,"c(""Preheat oven to 350°F and grease/flour a 13x9-inch baking pan."", ""Beat eggs; add sugar and oil."", ""Add the zucchini and vanilla; stir to mix well."", ""Sift the dry ingredients together and add to the egg mixture."", ""Pour batter into prepared pan and bake for 20 to 25 minutes, or until done."", ""While the bars are baking, whip the butter and cream cheese until light; add vanilla and powdered sugar."", ""Beat until fluffy, adding a *little* milk as needed if frosting is too thick."", ""Spread frosting on top of the bars when they are cooled.""
)"
2683,Zucchini Pizza,1549,Dave5003,PT20M,PT15M,PT35M,1999-09-06T04:45:00Z,Make and share this Zucchini Pizza recipe from Food.com.,character(0),< 60 Mins,"""Oven""","c(""1"", NA, ""2"", ""1"", ""1"", ""1  - 1 1/2"", ""1"", ""1"", NA)","c(""olive oil"", ""garlic cloves"", ""dried basil"", ""dried oregano"", ""zucchini"", ""tomatoes"", ""mozzarella cheese"", ""pre-shredded mozzarella cheese"", ""parmesan cheese"")",4,1,93.3,6.4,3.8,22.4,180.6,2.4,0.6,1.2,6.8,8,,"c(""Prepare your dough ( use my  dough recipes from my web page or from Dave's recipe archives) Place dough to fit 12 inch pan."", ""Brush dough with olive oil, mince over garlic.  Lay on sliced tomato, sprinkle on spices. Scatter on zucchini evenly."", ""Sprinkle on cheeses."", ""Bake in a hot oven (400-425°F) about 20 minutes or until dough is  done and cheese has melted."")"
2684,Apple and Cheddar Corn Muffins,1530,Carole Reu,,PT0S,PT0S,1999-09-05T19:22:00Z,Make and share this Apple and Cheddar Corn Muffins recipe from Food.com.,"""https://img.sndimg.com/food/image/upload/w_555,h_416,c_fit,fl_progressive,q_95/v1/img/recipes/26/84/pick5NTEp.jpg""",Quick Breads,"c(""Breads"", ""Breakfast"", ""Lunch/Snacks"", ""Apple"", ""Corn"", ""Fruit"", ""Vegetable"", ""< 15 Mins"", ""Oven"")","c(""1 2/3"", ""1 1/2"", ""1"", ""3/4"", ""1/2"", ""2 1/4"", ""1/3"", ""1"", ""1"", ""1/3"", ""3"")","c(""flour"", ""yellow cornmeal"", ""baking powder"", ""apple"", ""frozen corn"", ""low-fat cheddar cheese"", ""sugar"", ""cinnamon"", ""nutmeg"", ""canola oil"", ""eggs"")",4.5,3,206.6,8,1.1,47.6,143.4,29.2,1.9,9.8,5.3,12,,"c(""Preheat oven to 400."", ""Line 12 muffin cups with paper baking cups."", ""In large  bowl, combine flour, cornmeal, and baking powder."", ""Add apples, corn, cheese,  sugar, cinnamon, nutmg, stir to combine.  In small bowl, beat eggs and oil; stir into flour mixture (don't over beat...the mixture will be stiff).  Fill baking  cups and bake for 15 minutes."")"
2685,Hot Jonkanoo Shrimp,1659,WisTex,,PT0S,PT0S,1999-08-21T10:22:00Z,"Walker's Wood Jonkanoo Hot Pepper Sauce is made of Hot peppers blend with  scallions, garlic, onions.  Any hot sauce the cook prefers could probably be  used although they would probably want to adjust the quantity ""to taste"" if  using another sauce.   Hot Jonkanoo Shrimp",character(0),Very Low Carbs,"""< 15 Mins""","c(""450"", ""10"", ""15"", ""50"", ""1"", ""3"", ""1"", ""1"")","c(""jumbo shrimp"", ""red wine vinegar"", ""butter"", ""salt"", ""garlic"", ""lemon"", ""fresh parsley"")",5,1,124.3,7.7,4.4,112.3,561.5,3.2,0.9,0.4,11,6,,"c(""In a large skillet melt butter over a low flame.  Add garlic and cook lightly."", ""Mix in vinegar, Walker's Wood Jonkanoo Hot Pepper Sauce, and shrimp."", ""Saute for about 1 minute.  Remove and spread coated shrimp in a flat ovenproof dish."", ""Place under a hot grill until sizzling for about 3 minutes (do not overcook).  Garnish with parsley and lemon wedges."", ""Serve immediately with rice."")"
2686,Hot Jalapeno Pepper Jelly,1530,Carole Reu,PT20M,PT30M,PT50M,1999-08-24T05:17:00Z,Make and share this Hot Jalapeno Pepper Jelly recipe from Food.com.,"c(""https://img.sndimg.com/food/image/upload/w_555,h_416,c_fit,fl_progressive,q_95/v1/img/recipes/26/86/pic2UyIXv.jpg"", ""https://img.sndimg.com/food/image/upload/w_555,h_416,c_fit,fl_progressive,q_95/v1/img/recipes/26/86/picMhy4kz.jpg"")",Jellies,"c(""< 60 Mins"", ""For Large Groups"", ""Canning"", ""Easy"")","c(""1/2"", ""1 1/2"", ""1"", ""5"", ""1"")","c(""cranberry juice cocktail"", ""vinegar"", ""sugar"")",5,25,51.6,0,0,0,0.3,13.2,0,13.1,0,80,5 cups,"c(""Wash hot peppers, cut off stem and halve the peppers, remove membrane and seeds."", ""Put peppers in food processor and process off and on a couple of times until the peppers are coarsely chopped."", ""In a medium saucepan combine peppers, cranberry  juice, and vinegar."", ""Bring to boiling; reduce heat, cover and simmer for about  10 minutes."", ""In a 4 quart pot combine the pepper mixture and sugar."", ""Bring to  a full rolling boil over high heat, stirring constantly."", ""Stir in pectin."", ""Return to a full rolling boil; boil for 1 minute, stirring constantly."", 
""Remove  from heat and quickly skim off foam with a metal spoon."", ""Pour at once into hot,  sterilized half-pint jars, leaving a 1/4\"" headspace.  Wipe jar rims; adjust  lids."", ""Process in a boiling water canner for 5 minutes (start timing when water  begins to boil)."", ""Remove jars and cool on a wire rack till set (2 to 3 days)."")"
2687,Hot Pizza Dip,64203,Dine  Dish,PT10M,PT10M,PT20M,1999-08-15T07:39:00Z,Make and share this Hot Pizza Dip recipe from Food.com.,"""https://img.sndimg.com/food/image/upload/w_555,h_416,c_fit,fl_progressive,q_95/v1/img/recipes/26/87/picD09qmn.jpg""",< 30 Mins,"""Oven""","c(""8"", ""1"", ""1/4"", ""8"", ""4"", ""1/2"", ""1/2"", ""1/2"", NA)","c(""cream cheese"", ""garlic powder"", ""mozzarella cheese"", ""cheddar cheese"", ""green bell pepper"", ""red bell pepper"", ""tortillas"")",5,47,202.5,16.8,9.8,55.2,309.8,3.5,0.5,1.7,9.6,10,1 batch,"c(""Combine cream cheese and seasonings."", ""Spread  in the bottom of a 9 inch pie  plate. (I used a round cake pan). Combine  cheeses and sprinkle half over the  cream cheese layer."", ""Spread sauce over  that. Sprinkle remaining cheese on  top.Bake 350 for 20 minutes."", ""Serve  warm with breadsticks or tortilla chips."", ""(I  used pita triangles)."")"
2688,How to Toast Pecans,1573,benluc,PT5M,PT1M,PT6M,1999-08-26T04:07:00Z,Make and share this How to Toast Pecans recipe from Food.com.,"c(""https://img.sndimg.com/food/image/upload/w_555,h_416,c_fit,fl_progressive,q_95/v1/img/recipes/26/88/tjW36tOSIeiyM9ZBsKTg_0S9A3838.jpg"", ""https://img.sndimg.com/food/image/upload/w_555,h_416,c_fit,fl_progressive,q_95/v1/img/recipes/26/88/picGIUGBn.jpg"", ""https://img.sndimg.com/food/image/upload/w_555,h_416,c_fit,fl_progressive,q_95/v1/img/recipes/26/88/oaF1cYy2QGChSEaeZjCa_0S9A3833.jpg"", ""https://img.sndimg.com/food/image/upload/w_555,h_416,c_fit,fl_progressive,q_95/v1/img/recipes/26/88/0V8gKiSwTPeLMi8UyUbA_0S9A3840.jpg""
)",Lunch/Snacks,"c(""< 15 Mins"", ""Oven"", ""Easy"")","c(""1"", NA)","""pecans""",5,10,753.2,78.5,6.7,0,0,15.1,10.5,4.3,10,,1 cup,"c(""Preheat oven to 350°F."", ""Lightly spritz baking sheet with cooking spray."", ""To toast pecans, put them on a baking sheet and toast them just until they become aromatic, about 5 minutes."", ""You have to watch them carefully as they are easily scorched."")"
2689,Kidney With Spring Onions &amp; Cauliflower,1543,Doreen Randal,PT15M,PT20M,PT35M,1999-08-26T17:03:00Z,Make and share this Kidney With Spring Onions &amp; Cauliflower recipe from Food.com.,character(0),Beef Organ Meats,"c(""Lamb/Sheep"", ""Cauliflower"", ""Vegetable"", ""Meat"", ""Spring"", ""Broil/Grill"", ""< 60 Mins"", ""Oven"", ""Stove Top"")","c(""4"", ""2"", ""1"", ""4"", ""2"", ""1"", ""1"", ""1"", ""1"")","c(""sherry wine"", ""cauliflower"", ""spring onions"", ""cornflour"", ""soy sauce"", ""brown sugar"", ""salt"")",,,125.9,7.1,0.9,0,857.3,8.2,1.9,3.1,2.2,4,,"c(""Wash and core the kidneys, slice them thinly and soak in the sherry."", ""Break the cauliflower into very small florets and cook in salted boiling water 3 minutes."", ""Drain."", ""Cut the spring onions into 2 1/2cm lengths."", ""Heat the oil and fry the kidneys and onions with the cauliflower for 2 minutes."", ""Mix the cornflour to a smooth paste with the soy sauce, 2 Tbsp water, sugar, the remaining sherry and salt.  Add to the pan and cook gently 3 minutes, stirring all the time.  Serve immediately."", 
""Cheers,  Doreen Doreen Randal,  Wanganui,  New Zealand."")"
2690,Kumara and Red Lentil Soup,1543,Doreen Randal,PT30M,PT15M,PT45M,1999-09-13T16:56:00Z,Make and share this Kumara and Red Lentil Soup recipe from Food.com.,character(0),Lentil,"c(""Beans"", ""New Zealand"", ""Low Protein"", ""Low Cholesterol"", ""Healthy"", ""< 60 Mins"")","c(""1"", ""1"", ""1"", ""1/2"", ""750"", ""1"", ""6"", ""2"", ""1"", NA)","c(""onion"", ""cumin"", ""kumara"", ""red lentil"", ""water"", ""soy sauce"", ""yoghurt"", ""sour cream"")",5,3,1505.4,19,2.8,1.2,3784.4,278.5,45.4,36.4,64.4,,1 batch,"c(""Heat oil in pan, add onion, coriander and cumin; cook, stirring, until onion is  soft.  Add kumara, lentils, water and crumbled stock cubes."", ""Bring to the boil  and simmer, covered, for about 30 minutes or until kumara is tender."", ""Blend  soup, in batches, until pureed."", ""Return to pan, stir over heat until heat until  hot.  Stir in soy sauce.  Serve with a dollop of sour cream or yoghurt."", ""Cheers,  Doreen. Doreen Randal,  Wanganui, New Zealand."")"
2691,Lamb Chops with Mandarins,1543,Doreen Randal,PT35M,PT10M,PT45M,1999-09-18T16:13:00Z,"I have cheated making this and used canned mandarins, must admit though, if you have enough of the fruit it's nicer.",character(0),Lamb/Sheep,"c(""Meat"", ""< 60 Mins"")","c(""6"", ""2"", NA, NA, ""1"", ""1/2"", ""1/2"", ""1/2"", NA)","c(""cornflour"", ""butter"", ""water"", ""white wine"", ""mandarin juice"", ""mandarin segment"", ""watercress"", ""parsley"")",4,1,36.5,0.1,0,0,1.6,5.4,0.4,4,0.3,6,,"c(""Trim the chops so the are neat and free from any excess fat. Roll the tails up so the chops make a round, if necessary secure with a toothpick."", ""In a large pan, heat just enough butter to cover the bottom of the pan and brown the chops on both sides."", ""Season lightly with salt and pepper."", ""Add the wine and mandarin juice.  Cover, lower heat and simmer until the meat is quite tender--About 30 mins."", ""When it is cooked, lift the meat on to a serving plate and keep warm."", ""Mix the cornflour and water to a smooth paste and stir into the pan juices."", 
""Cook quickly with regular stirring until they thicken slightly."", ""Add the mandarin segments to the sauce and cook about 1 minute.  Pour the sauce over the chops and garnish with parsley."", ""Serves 6."", ""N.B.---- To make mandarin juice, crush mandarin segments and strain the juice from them."", ""Cheers, Doreen Doreen Randal,  Wanganui."", ""New Zealand."")"
2692,Lavash Armenian Thin Bread,1556,Strawberry Girl,,PT0S,PT0S,1999-09-15T04:39:00Z,Make and share this Lavash Armenian Thin Bread recipe from Food.com.,character(0),Breads,"c(""Low Cholesterol"", ""Healthy"", ""< 15 Mins"", ""Oven"")","c(""1 1/3"", ""1/4"", ""3"", ""1"", ""2"", ""4"", ""1/2"", NA)","c(""water"", ""olive oil"", ""sugar"", ""quick-rising yeast"", ""salt"", ""all-purpose flour"", ""milk"")",5,4,1272.6,32,5.5,8.5,2367.7,214,7.7,19.5,29.3,,2 loaves,"c(""Place the tepid water in your electric mixing bowl and add the olive oil, sugar, and yeast. Using the batter blade let the electric mixer blend these very well."", ""It will take about 5 minutes on low speed."", ""Stir in the salt. Gradually add 2  cups of the flour and beat on low speed until a thick and smooth batter forms."", ""Change the blade to a bread dough hook and knead in the additional 2 cups of  flour."", ""If you do not have a heavy mixer such as a KitchenAid, incorporate the  flour with a wooden spoon and finish the kneading by hand."", 
""Kneading should take  about 10 minutes in the machine, 20 minutes by hand."", ""Place the dough on a plastic countertop and cover with a large stainless-steel  bowl."", ""Allow the dough to rise until double in bulk, about 1 1/2 hours."", ""Punch the dough down and divide into 8 pieces."", ""Let stand, covered, 15 minutes."", ""Roll out  each piece of dough into a 12-inch-diameter circle. Working with 2 pieces of  dough at a time, arrange breads on ungreased baking sheets."", ""Brush with milk and  sprinkle sesame seeds over tops."", 
""Pierce with a fork many times, all over."", ""Bake on the lowest racks in the oven, at 375F, for 8-10 minutes, or until light brown."", ""Rotate the pans in the oven from top to bottom, to insure even browning."", ""Serve dry or wet. (To wet, hold the cracker under running water until lightly  moistened all over, and then wrap in a moist towel for 10-15 minutes.) If the  cracker is too dry to roll, it will crack."", ""Sprinkle with a little more water and let stand a few minutes."", ""If it is too wet, cover with a dry towel and let it  stand.""
)"
2693,Layered Berry Parfaits,1533,Dancer,,PT0S,PT0S,1999-08-09T16:36:00Z,Make and share this Layered Berry Parfaits recipe from Food.com.,character(0),< 15 Mins,,"c(""1"", ""1"", ""1"", ""1"", ""1/3"", ""1 1/2"", ""3"", ""2"", ""4"")","c(""fresh blueberries"", ""fresh strawberries"", ""fresh red currant"", ""fresh blackberries"", ""sweet dessert wine"", ""fresh red raspberries"", ""maple syrup"", ""fresh mint leaves"")",,,694.3,22.8,5.6,0,351.9,114.2,10,21.6,6.9,4,,"c(""In a large bowl, combine blueberries, strawberries, currants, blackberries, and wine or apple juice. Let stand for 20 minutes, stirring occasionally."", ""Meanwhile, puree raspberries and syrup in a blender or food processor until smooth."", ""To assemble dessert, spoon a layer of mixed berries into the bottom of 4 parfait glasses or wine glasses."", ""Top with a drizzle of raspberry puree, then vanilla wafer crumbs."", ""Repeat until all ingredients are used, ending with a drizzle of raspberry puree.  Garnish each serving with a sprig of mint. If desired, chill parfaits for 1 hour before serving."", 
""Variation: Substitute any other fresh berries for those listed above.  Helpful Hint: You may substitute frozen berries for fresh, if desired, but frozen berries will exude more juice than fresh berries."")"
2694,Lemon Chicken and Potatoes with Garlic Sour Cream,1549,Dave5003,,PT0S,PT0S,1999-09-02T04:13:00Z,This is a chicken substitution for a similar lamb dish we tried in a  Greek restaurant in Toronto a few years back.,character(0),Chicken Breast,"c(""Whole Chicken"", ""Chicken"", ""Potato"", ""Poultry"", ""Vegetable"", ""Meat"", ""Greek"", ""European"", ""< 15 Mins"", ""Oven"")","c(""2"", ""1/3"", ""3 -5"", ""1"", NA, ""1"", ""2 -3"", ""1 1/2"", ""1/3"", ""3 -5"", ""1"", NA, NA, ""3 -4"", ""8 -10"")","c(""olive oil"", ""fresh lemon juice"", ""garlic"", ""chicken"", ""chicken breast"", ""potatoes"", ""fresh lemon juice"", ""garlic"", ""sea salt"", ""black pepper"", ""garlic"", ""sour cream"")",3,2,438.4,27.6,9.5,100.8,167.1,21.9,2.2,2,25.6,8,,"c(""Mix olive oil, lemon juice, garlic, threebe, salt and pepper well & let stand 10 minutes; pour over chicken."", ""Let Marinade 1-1/2 hours refrigerated."", ""Bake at 400F for ~ 1 hour or until done. Serve with potatoes."", ""Arrange potatoes in glass baking dish (multiple layers)."", ""Pour mixture of stock, lemon juice, garlic, threebe, salt and pepper over potatoes & bake at 400F until slightly golden brown on  top"", ""Fold garlic into sour Cream Cover and let stand 1 hour refrigerated."", ""Serve as a dip/accompaniment for potatoes""
)"
2695,Lemon Jello Cake,1664,Duane and Ginger Va,PT35M,PT10M,PT45M,1999-08-16T05:36:00Z,Make and share this Lemon Jello Cake recipe from Food.com.,"""https://img.sndimg.com/food/image/upload/w_555,h_416,c_fit,fl_progressive,q_95/v1/img/recipes/26/95/piczJs6tS.jpg""",Gelatin,"c(""Dessert"", ""< 60 Mins"", ""Oven"")","c(""1"", ""1"", ""4"", ""3/4"", ""3/4"", ""2"", ""2"", ""2"")","c(""eggs"", ""water"", ""powdered sugar"", ""lemons, juice and zest of"", ""butter"")",5,28,456.9,22.2,4.3,68,362.1,61.2,0.5,44.9,4.6,,,"c(""Mix cake ingredients together for 4 minutes."", ""Bake in metal non stick 9x13 inch pan @350 for 40 minutes."", ""or,if using a glass baking dish bake @325 for 45 minutes."", ""Poke holes all over the cake while hot."", ""Mix together icing: powdered sugar and lemons (grated rind and juices)."", ""Pour this over the cake immediately, while it is still hot from the oven."", ""Serve warm or cold."")"
