RecipeId,Name,AuthorId,AuthorName,CookTime,PrepTime,TotalTime,DatePublished,Description,Images,RecipeCategory,Keywords,RecipeIngredientQuantities,RecipeIngredientParts,AggregatedRating,ReviewCount,Calories,FatContent,SaturatedFatContent,CholesterolContent,SodiumContent,CarbohydrateContent,FiberContent,SugarContent,ProteinContent,RecipeServings,RecipeYield,RecipeInstructions
3815,Mediterranean Veal Burgers,1533,Dancer,,PT0S,PT0S,1999-10-31T12:55:00Z,Make and share this Mediterranean Veal Burgers recipe from Food.com.,character(0),Veal,"c(""Meat"", ""European"", ""Broil/Grill"", ""< 15 Mins"", ""Oven"")","c(""1"", ""1"", ""1"", ""1/2"", ""1/2"", ""4"", ""1/3"", ""2"", ""1/2"")","c(""focaccia bread"", ""egg"", ""salt"", ""pepper"", ""eggplants"", ""basil pesto"", ""basil pesto"")",,,204.2,9.3,3.7,139.5,647.3,4.9,3.4,0.2,25.6,,4,"c(""Cut focaccia into quarters."", ""Using a serrated knife, split each quarter horizontally in half."", ""Pull out 1/4 inch soft bread crumbs from cut sides of tops of focaccia; process in food processor fitted with metal blade. Reserve 1/4 cup bread crumbs for veal mixture; reserve remaining crumbs for another use (may be frozen up to 3 months). In medium bowl, combine veal, bread crumbs, egg, salt and pepper, mixing lightly but thoroughly."", ""Shape into four 1/2-inch thick patties."", ""Brush both sides of eggplant slices with 2 tablespoons pesto."", 
""Place patties in center of grid over medium, ash-covered coals; place eggplant slices a round edges of grid."", ""Grill, uncovered, 12 to 14 minutes or until centers of burgers are no longer pink and eggplant slices are tender, turning once. Place focaccia, cut side down, on grid."", ""Grill 1 to 2 minutes."", ""Spread remaining 1/3 cup pesto over cut sides of focaccia."", ""Arrange eggplant slice and red pepper on bottoms of focaccia; top with burger."", ""Close sandwich."")"
3816,Grilled Chicken and Red Pepper Focaccia,1533,Dancer,,PT0S,PT0S,1999-10-31T17:24:00Z,Make and share this Grilled Chicken and Red Pepper Focaccia recipe from Food.com.,character(0),Chicken Breast,"c(""Chicken"", ""Poultry"", ""Meat"", ""< 15 Mins"")","c(""4"", ""1/3"", ""2"", ""1"", ""1"", ""1"", ""1/2"", ""1/2"", NA, ""2"", ""1"", NA)","c(""boneless skinless chicken breasts"", ""olive oil"", ""lemon juice"", ""white wine vinegar"", ""fresh basil"", ""garlic"", ""Dijon mustard"", ""sugar"", ""black pepper"", ""focaccia bread"", ""fresh basil leaf"")",3,1,317.3,21.3,3.2,75.5,146.9,4.9,1.3,3.2,25.8,,4,"c(""Preheat barbecue to medium heat. Place chicken in a large, sealable plastic bag."", ""In a bowl, stir together oil, lemon juice, vinegar, basil, garlic, mustard, sugar and ground pepper."", ""Pour half the mixture over the chicken."", ""Seal plastic bag, pressing out excess air, and refrigerate at least 30 minutes."", ""Save the remaining marinade to baste the chicken during grilling."", ""Meanwhile, grill whole red peppers on barbecue until skin is blackened on all sides."", ""Place peppers in a paper bag, fold shut and let cool 10 minutes."", 
""Pull skins from peppers."", ""Cut peppers in half, discard seeds and membranes, and dice. Stir gently into remain ing oil mixture and set aside. Drain chicken."", ""Place chicken on barbecue and grill for about 7 minutes on each side, or until no longer pink inside. Baste with reserved marinade during first half of cooking."", ""Let cool slightly and slice. Cut focaccia in 4 then cut each piece in half along the thickness."", ""Divide chicken, grilled peppers and basil between 4 pieces."", ""Top with remaining pieces of focaccia and serve. Makes 4 servings.""
)"
3817,Berry Blast Smoothie,1533,Dancer,,PT0S,PT0S,1999-11-01T00:55:00Z,Make and share this Berry Blast Smoothie recipe from Food.com.,character(0),Smoothies,"c(""Beverages"", ""< 15 Mins"", ""Easy"")","c(""1"", ""1"", ""2"")","c(""fat-free strawberry cream yogurt"", ""mixed berry"")",4,2,263.1,0.5,0.1,0,7.8,64.9,4.8,4.2,3.8,1,,"c(""Combine in a blender and mix until smooth."", ""Thin with more orange juice if desired."")"
3818,Fresh Peach Pudding Cake,1866,Helen Watson1,PT35M,PT15M,PT50M,1999-11-01T00:59:00Z,Make and share this Fresh Peach Pudding Cake recipe from Food.com.,character(0),Dessert,"c(""< 60 Mins"", ""< 15 Mins"", ""Oven"")","c(""110"", ""50"", ""1"", ""1"", ""50"", ""1"", ""3"", ""3"", ""50"", ""1/2"", ""1/4"", ""2"")","c(""plain flour"", ""caster sugar"", ""baking powder"", ""salt"", ""butter"", ""egg"", ""milk"", ""demerara sugar"", ""ground cinnamon"", ""ground nutmeg"", ""butter"")",,,1673.1,72.3,43.1,385.8,1063.5,237.8,8.9,125.6,25.4,,1 (20 cm) cake,"c(""Butter a 20 cm round sandwich tin, at least 2.5 cm deep, then place the flour,  sugar, baking powder and salt into a bowl."", ""Rub in the butter, until the mixture resembles fine breadcrumbs."", ""Break the egg into a separate basin and beat it  together with the milk."", ""Then pour this on to the rubbed in mixture and stir with a wooden spoon until it forms a soft dough."", ""Next turn the mixture into the prepared tin and carefully level it off with the back of a spoon."", ""Skin the peaches by placing them in a bowl and pouring over enough boiling water to just  cover them.  Leave the peaches for a minute or  two, then drain and carefully  peel off the skins."", 
""Slice each peach fairly thinly, discarding the stone and  arrange the slices over the top of the cake mixture."", ""In another bowl mix the  sugar, cinnamon and nutmeg together and sprinkle this over the top of the  peaches."", ""Follow this with a sprinkling of melted butter, then bake for 30-35  minutes in a preheated oven at 200 C / 400 F / Gas 6 or until the mixture is  slightly  risen and seems lightly browned and bubbly."", ""This is nicest served warm with some very cold pouring cream."")"
3819,Toffee Apples,1866,Helen Watson1,PT45M,PT10M,PT55M,1999-11-01T01:03:00Z,Make and share this Toffee Apples recipe from Food.com.,character(0),Dessert,"c(""Apple"", ""Fruit"", ""Low Protein"", ""Low Cholesterol"", ""Healthy"", ""Kid Friendly"", ""< 60 Mins"")","c(""6 -8"", ""450"", ""150"", ""75"", ""1/4"", ""110"", ""110"")","c(""apples"", ""demerara sugar"", ""water"", ""butter"", ""cream of tartar"", ""treacle"", ""golden syrup"")",,,584.5,10.4,6.4,26.7,111.4,129.4,4.4,109.3,0.6,,6-8 toffee apples,"c(""Push a wooden cocktail stick into each apple core, making sure they are secure.  Put the sugar and water in a large heavy-based saucepan, with a sugar  thermometer attached, and heat gently until dissolved."", ""Add the remaining  ingredients and bring to the boil."", ""Boil until the temperature reaches the soft  crack stage 143 C (290 F), when a little of the syrup dropped into cold water  separates into hard but not brittle threads."", ""Brush down the sides of the pan  occasionally with a pastry brush dipped in cold water."", 
""Do not stir."", ""Dip the  apples into the toffee, twirl around for a few seconds to allow excess toffee to drip off, then leave to cool and set on a buttered baking sheet or waxed paper."", ""Do not keep for more than 1 day."")"
3820,Roquefort Dressing II,1866,Helen Watson1,,PT0S,PT0S,1999-11-01T01:10:00Z,Make and share this Roquefort Dressing II recipe from Food.com.,character(0),< 15 Mins,"""Easy""","c(""600"", ""125"", ""1/2"", ""1/4"", ""1"", ""1/2"", ""1/2"", ""1"", ""1/8"", ""1"", ""1 1/2"", ""75"")","c(""white wine vinegar"", ""tarragon vinegar"", ""dried oregano"", ""bay leaf"", ""Worcestershire sauce"", ""black pepper"", ""cayenne pepper"", ""garlic"", ""sour cream"", ""Roquefort cheese"")",,,4917.9,545.3,88.4,75.4,1462,7.3,1.1,1,17.3,1,,"c(""Put all the ingredients except the Roquefort cheese in a blender and blend well."", ""Add the crumbled roquefort cheese and stir to mix."", ""Store in the refrigerator."")"
3821,Cinnamon Apple Tart,1866,Helen Watson1,,PT0S,PT0S,1999-10-29T03:22:00Z,Make and share this Cinnamon Apple Tart recipe from Food.com.,character(0),Dessert,"c(""Apple"", ""Fruit"", ""Low Protein"", ""< 15 Mins"", ""Oven"")","c(""50"", ""250"", ""2"", ""3"", ""1"", ""1"")","c(""butter"", ""puff pastry"", ""brown sugar"", ""apples"", ""lemon juice"", ""cinnamon"")",,,518.7,34.1,12.4,26.7,231.4,50.9,4.4,18,5,4,,"c(""Brush a little of the butter into a loose bottom 23 cm pie tin.  Preheat oven to 200 C / 400 F/ Gas 6."", ""Roll out the pastry and line the base of the tin with the pastry.   Brush generously with butter and sprinkle half the sugar over the  pastry, avoiding the edges."", ""Toss the apple slices in the lemon juice and coat  with the remaining sugar and cinnamon."", ""Cover the base with the apples, leaving  a 2 cm gap around the edge.  Drizzle the remaining butter over the apples and   dust with a little more cinnamon."", 
""Bake in the middle of the oven for 20 - 25  minutes until the apple is soft and slightly golden and the pastry rim looks  crisp."")"
3823,Chicken Lasagna & Meat Sauce,1533,Dancer,,PT0S,PT0S,1999-11-01T05:18:00Z,Make and share this Chicken Lasagna & Meat Sauce recipe from Food.com.,character(0),Chicken,"c(""Poultry"", ""Meat"", ""European"", ""< 15 Mins"", ""Oven"")","c(""1"", ""2"", ""1/2"", ""1/2"", ""9"", ""1"", ""2"", ""2"", ""2"", ""2"", ""2"", ""1 1/2"", ""1"", ""2"", ""1"", ""1/8"", ""1"")","c(""cottage cheese"", ""eggs"", ""parmesan cheese"", ""mozzarella cheese"", ""ground chicken"", ""onions"", ""garlic"", ""basil"", ""oregano"", ""salt"", ""mushrooms"", ""tomato paste"", ""tomato sauce"", ""water"", ""pepper"", ""sugar"")",,,820.5,34.1,15.2,265.8,3188.9,65.9,6.4,19.1,64.5,,,"c(""Preheat oven to 350 F."", ""Mix cottage cheese, beaten eggs and parmesan cheese. Spread < of the meat sauce in the bottom of a 9X13 pan and top with 3 noodles."", ""Top with sauce, = of the cottage cheese mixture and 1/3 of the mozzarella."", ""Repeat with 3 more noodles, sauce and cheeses."", ""Finish with 3 noodles and the remaining sauce and mozzarella."", ""Bake for 30 minutes or until noodles are tender and the cheese has melted."", ""In a large non-stick skillet, stir cook ground chicken, onion, garlic , basil, oregano and salt until the chicken is no longer pink."", 
""Add remaining ingredients and simmer for 30 minutes."", ""Leftover sauce can be frozen and reheated in the microwave. ."")"
3824,Currant and Port Jelly,1866,Helen Watson1,,PT0S,PT0S,1999-11-01T05:17:00Z,Make and share this Currant and Port Jelly recipe from Food.com.,character(0),Jellies,"c(""< 15 Mins"", ""Canning"", ""Easy"")","c(""1 1/2"", ""600"", NA, ""3"")","c(""red currants"", ""black currants"", ""water"", ""sugar"", ""port wine"")",,,854.9,2.8,0.2,0,36,199.3,60.2,106.6,19.7,,1 batch,"c(""There is no need to remove the currants from their stalks."", ""Put the currants in  a preserving pan with the water and simmer gently for 30 minutes, until the  fruit is really soft and pulpy."", ""Stir from time to time to prevent sticking."", ""Spoon the fruit pulp into a jelly bag or cloth attached to the legs of an  upturned stool, and leave to strain into a large bowl for at least 12 hours."", ""Do not squeeze. Discard the pulp remaining in the jelly bag."", ""Measure the extract  and return it to the pan with 450g sugar for each 600 ml extract. Heat gently,  stirring, until the sugar has dissolved, then boil rapidly for about 15 minutes."", 
""Test for a set and, when the setting point is reached, remove the pan from the  heat. Stir in the port, skim the surface with a slotted spoon and pot and cover  the jelly."")"
3826,Green Olives,1880,P J  D Denny,,PT0S,PT0S,1999-11-01T05:23:00Z,Make and share this Green Olives recipe from Food.com.,character(0),Greek,"c(""European"", ""Very Low Carbs"", ""Low Protein"", ""Low Cholesterol"", ""< 15 Mins"")","c(""5"", ""5"", ""500"", ""2"", ""1 1/2"", ""2"", ""200"")","c(""green olives"", ""water"", ""salt"", ""vinegar"", ""water"", ""salt"")",,,19657.5,2128.5,277.9,0,349356.4,192.8,165,27.8,51.5,1,,"c(""Put the olives in a large bowl of water have having nicked each one on one side. Allow to stand for 20 days, changing the water every day - also, cover."", ""Then prepare a solution with  the 500 grams salt and 5 litres of water and stand the olives in this for 10 days."", ""After the 10 days empty this brine and prepare  another solution with  2 litres of water and 200 grams of salt.  Add to this the vinegar and oil and allow the olives to stand in this for 3 days, they are then  ready."", ""After you have tried this method you will soon be able to adapt it to your own  taste.  Also, it is nice to put into the final solution maybe garlic, slices of  lemon or a sprig of fennel."", 
""This is purely taste."")"
3827,Chocolate Cream Truffles,1866,Helen Watson1,,PT0S,PT0S,1999-11-01T05:25:00Z,Make and share this Chocolate Cream Truffles recipe from Food.com.,character(0),Candy,"c(""Dessert"", ""< 15 Mins"")","c(""150"", ""350"", ""2"", ""25"", NA, NA, NA)","c(""chocolate"", ""orange brandy"", ""unsalted butter"", ""chocolate"", ""white chocolate"", ""chocolate"")",,,76.1,8,5,7.3,4.4,3.5,1.9,0.1,1.6,,36 truffles,"c(""Heat the cream  in a small pan until boiling, remove from the heat and add the  chocolate, stir until melted."", ""Add the brandy and the butter, stir until the  butter has melted."", ""Freeze until firm enough to hold its shape, approximately 20  minutes."", ""Using a melon baller scoop out rounds and place onto non-stick baking  paper, chill until firm."", ""Either roll the truffles in a little cool, melted  chocolate in your hands or dip into melted chocolate.  Place in a small paper  caseor roll in grated chocolate.  Store in the refrigerator.""
)"
3828,Caribbean Chicken with Pineapple,1866,Helen Watson1,PT1H,PT15M,PT1H15M,1999-11-01T05:26:00Z,Make and share this Caribbean Chicken with Pineapple recipe from Food.com.,character(0),Chicken,"c(""Pineapple"", ""Poultry"", ""Tropical Fruits"", ""Fruit"", ""Meat"", ""Caribbean"", ""Weeknight"", ""Oven"", ""< 4 Hours"")","c(""4"", ""1"", ""1"", ""250"", NA, ""4"", ""1"", ""1"")","c(""chicken"", ""curry powder"", ""pineapple rings"", ""banana"", ""orange"")",3.5,8,117.1,1.2,0.3,1.9,92.9,26.2,3.7,17.2,3.1,4,,"c(""Put the chicken portions in a casserole dish with the chopped pepper and curry powder."", ""Pour over the stock and add salt and pepper."", ""Cover and cook in a  preheated hot oven at 220 C / 425 F / Gas 7 for 50 minutes."", ""Chop the pineapple rings and banana and add to the casserole.  Cook for a 10 minutes or until the chicken is tender."", ""Garnish the casserole with the orange slices."")"
3830,Deep Fried Fish,1866,Helen Watson1,,PT0S,PT0S,1999-11-01T05:30:00Z,Make and share this Deep Fried Fish recipe from Food.com.,character(0),Healthy,"""< 15 Mins""","c(""8"", ""110"", ""1/4"", ""1"", ""1"", ""150"", NA)","c(""plain flour"", ""self raising flour"", ""salt"", ""egg"", ""butter"", ""milk"", ""lemon wedge"")",5,2,358,8.2,3.5,188.9,334.4,28,0.9,0.2,40,4,,"c(""Half-fill a deep pan with melted fat or oil. Heat until a faint haze rises from it (or until a bread cube sinks to the bottom of the pan, rises to the top immediately and turns golden in 50 seconds)."", ""Sift the flour and salt into a  bowl."", ""Beat to a smooth batter, unbeaten egg, butter and milk. Then add the flour and salt mixture."", ""Coat 2  pieces of fish with batter."", ""Lift into the pan with a fork or kitchen tongs."", ""Fry until crisp and golden, allowing about 6-8 minutes for large pieces and 4-5  minutes for medium."", 
""Remove from the pan and drain on absorbent kitchen paper."", ""Repeat with the remaining fish."", ""Garnish with lemon wedges."")"
3831,Choco-Banana Wonder Smoothie,1533,Dancer,,PT0S,PT0S,1999-11-01T05:31:00Z,Make and share this Choco-Banana Wonder Smoothie recipe from Food.com.,character(0),Smoothies,"c(""Beverages"", ""< 15 Mins"", ""Easy"")","c(""1"", ""2"", ""2"", ""1"")","c(""plain nonfat yogurt"", ""peanut butter"", ""banana"")",4,1,349.9,7.4,2,5.2,282.9,55.7,4.1,38.4,18.6,1,,"""Combine in a blender and mix until smooth."""
3832,Cheese Bran Muffins,1533,Dancer,,PT0S,PT0S,1999-11-01T05:34:00Z,Make and share this Cheese Bran Muffins recipe from Food.com.,character(0),Quick Breads,"c(""Breads"", ""Cheese"", ""High In..."", ""< 15 Mins"", ""Oven"")","c(""1"", ""1 1/4"", ""1"", ""1/4"", ""1 1/2"", ""1/4"", ""1 1/2"", ""1/2"", ""1/2"", ""1"")","c(""buttermilk"", ""egg"", ""all-purpose flour"", ""granulated sugar"", ""baking powder"", ""baking soda"", ""salt"", ""sharp cheddar cheese"")",4,1,2168.7,104.4,34.8,342.4,3578.9,255.8,22.7,75.5,71.8,,1 batch,"c(""In small bowl, combine cereal and buttermilk."", ""In medium bowl, beat egg until  frothy and stir in oil and cereal mixture."", ""In large bowl, combine remaining  ingredients."", ""Make a well in centre and pour batter into well. Stir to moisten.  Batter will be lumpy."", ""Fill greased muffin cups > full. Bake at 400 degrees for  20 to 25 minutes. TIP: Nice when served warm, but let stand 5 minutes first."")"
3834,Dill-Lemon Rice,1533,Dancer,PT25M,PT5M,PT30M,1999-11-01T05:38:00Z,Make and share this Dill-Lemon Rice recipe from Food.com.,"c(""https://img.sndimg.com/food/image/upload/w_555,h_416,c_fit,fl_progressive,q_95/v1/img/recipes/38/34/picIg9mX2.jpg"", ""https://img.sndimg.com/food/image/upload/w_555,h_416,c_fit,fl_progressive,q_95/v1/img/recipes/38/34/picHhbK9Q.jpg"")",Long Grain Rice,"c(""Rice"", ""Low Protein"", ""Low Cholesterol"", ""Healthy"", ""< 30 Mins"", ""Easy"")","c(""1"", ""1 1/2"", ""1"", ""1"", ""3"", ""2"", ""1"")","c(""long grain rice"", ""dill weed"", ""salt"", ""instant chicken bouillon"", ""water"", ""butter"", ""margarine"")",5,5,194.8,3.2,1.9,7.6,630.7,37.1,0.7,0.1,3.4,,,"c(""Combine rice, lemon peel, dill weed, salt and chicken bouillon in a large bowl and blend well."", ""Put into to a medium saucepan and add water and butter."", ""Bring to a boil over high heat; cover and reduce heat."", ""Cook for 15 to 25 minutes until liquid is absorbed."")"
3836,Low-Fat Breakfast Brulee,1533,Dancer,,PT0S,PT0S,1999-11-01T05:41:00Z,Make and share this Low-Fat Breakfast Brulee recipe from Food.com.,character(0),Breakfast,"c(""Low Protein"", ""Low Cholesterol"", ""Healthy"", ""< 15 Mins"", ""Easy"")","c(""1 1/2"", ""3"", ""2/3"")","c(""fresh raspberries"", ""blueberries"", ""brown sugar"")",,,108.6,0.2,0,0,9.9,27.6,2,25,0.4,6,,"c(""Divide berries among 6 custard cups."", ""Spread yogurt cheese evenly over berries."", ""Press brown sugar through sieve to get rid of any lumps. Sprinkle top  of each custard cup with about 2 Tbsp brown sugar."", ""Place custard cups on baking  sheet and broil for 1 to 2 minutes, watching carefully, until sugar melts and begins to brown (it burns very easily). Allow to rest for a few minutes until topping is firm, then serve immediately."", ""I estimate that three cups yogurt cheese is the result of draining the whey from 6 cups plain lowfat yogurt through a yogurt strainer, cheesecloth or a fine sieve overnight in a refrigerator.""
)"
3837,Country Rice,1533,Dancer,PT20M,PT10M,PT30M,1999-11-01T05:42:00Z,Make and share this Country Rice recipe from Food.com.,"""https://img.sndimg.com/food/image/upload/w_555,h_416,c_fit,fl_progressive,q_95/v1/img/recipes/38/37/picIpKG5y.jpg""",White Rice,"c(""Rice"", ""Low Cholesterol"", ""Healthy"", ""< 30 Mins"", ""Easy"")","c(""1/3"", ""1/3"", ""1"", ""1/3"")","c(""green onion"", ""black pepper"", ""white rice"")",4.5,3,66.9,0.3,0.1,0.6,31,13.9,0.7,0.5,1.7,4,,"c(""Bring the stock to a boil with the green onion and pepper."", ""Add the rice; turn  down to a simmer and cover; cook for 20 minutes."", ""NOTE: If you want drier rice, remove the cover at 20 minutes and heat just a  minute or so longer."", ""VARIATIONS: Rice made with fish stock can be served with  fish, beef-stock rich with beef."", ""If you begin adding more vegetables, you will  end up with a jambalaya instead of a side course of Country Rice."")"
3838,Apple Cheese Crisp II,1549,Dave5003,,PT0S,PT0S,1999-11-01T07:24:00Z,Make and share this Apple Cheese Crisp II recipe from Food.com.,character(0),Dessert,"c(""Cheese"", ""Apple"", ""Fruit"", ""Low Protein"", ""< 15 Mins"", ""Oven"")","c(""5"", ""1/2"", ""1/2"", ""1"", ""1/2"", ""1/2"", ""2"", ""1"", ""1"", ""1/2"", ""1"", ""1"", ""1/2"")","c(""apples"", ""sugar"", ""brown sugar"", ""lemon, rind of"", ""cinnamon"", ""water"", ""cider"", ""lemon juice"", ""flour"", ""sugar"", ""salt"", ""butter"")",3,2,3344.5,128,79.8,349,3802.5,532.7,26.2,402.3,41.4,1,,"c(""Preheat over to 325 degrees."", ""Peel, core and slice apples."", ""Place apples into buttered 8 x 8 baking dish."", ""Combine sugar, brown sugar, lemon peel, cinnamon and coriander."", ""Sprinkle over apples."", ""Mix well with your hands."", ""Combine water/cider and lemon juice.  Sprinkle mixture over apples."", ""In medium bowl (or food processor) combine ingredients for topping."", ""Mix unt il crumbly."", ""Put topping over apples, patting down with your hands."", ""Bake for 55-60 minutes until mixture is golden brown and bubbles up in the center."", 
""Serve warm with cream, whipped topping or ice cream."", ""(NOTE: ANY apples can be used in this.  It is a quick use for leftover eating apples such as Red Delicious.)"")"
3839,Honey Fruitcake,1549,Dave5003,,PT0S,PT0S,1999-11-01T07:26:00Z,Make and share this Honey Fruitcake recipe from Food.com.,character(0),Dessert,"c(""Fruit"", ""Christmas"", ""< 15 Mins"", ""Oven"")","c(""1/2"", ""1 1/2"", ""3"", ""1"", ""1/2"", ""1"", ""1"", ""1/2"", ""1/4"", ""1/2"", ""1/2"", ""2"")","c(""butter"", ""margarine"", ""honey"", ""eggs"", ""flour"", ""baking soda"", ""salt"", ""nutmeg"", ""molasses"", ""raisins"", ""walnut pieces"")",,,6503.8,262.3,78.3,802,2114.2,979.4,32.6,789.7,77.8,1,,"c(""Cream butter, honey and eggs."", ""Combine dry ingredients and add alternately to  creamed mixture with whiskey."", ""Place in a well greased and paper lined loaf pan."", ""Bake in a preheated 350F oven until set ( about 1 1/2 to 2 hours ). Cool  completely and wrap in whiskey moistened cheesecloth and store airtight."")"
3840,Honey Cheesecake,1549,Dave5003,PT1H,PT15M,PT1H15M,1999-11-01T07:24:00Z,Make and share this Honey Cheesecake recipe from Food.com.,character(0),Cheesecake,"c(""Dessert"", ""Oven"", ""< 4 Hours"", ""Easy"")","c(""2"", ""2/3"", ""4"", ""1"")","c(""cream cheese"", ""honey"", ""eggs"", ""vanilla"")",5,4,416,33.6,20.6,184.4,297.5,21.2,0.1,19,9.4,10,,"c(""Have ingredients at room temperature. Beat cream cheese smooth and fluffy."", ""Beat  in honey and vanilla."", ""Blend in eggs."", ""Pour into a  buttered and crumb lined  9 inch springform pan."", ""Place in a hot water bath."", ""Bake in a 350F oven until set ( about 1 1 /2 hours or less ). Remove from waterbath  to cool on rack."", ""Chill over night before serving."")"
3841,Biscuits and Sausage Gravy,1612,JANIC412,,PT0S,PT0S,1999-11-01T07:27:00Z,Make and share this Biscuits and Sausage Gravy recipe from Food.com.,character(0),Breads,"c(""Breakfast"", ""Pork"", ""Meat"", ""< 15 Mins"")","c(""1"", NA, ""2"", ""3"", ""1/2"", ""1/4"", ""1/8"", ""2 1/2"")","c(""sausage"", ""butter"", ""flour"", ""dry mustard"", ""salt"", ""black pepper"", ""milk"")",5,5,855.7,70.6,29.1,163.8,2070.7,23.2,0.4,0.1,31,,2 1/2 cups,"c(""Cook sausage, remove from pan and drain."", ""In a saucepan over med.-high heat melt the butter-stir in the flour and whisk until smooth."", ""Add mustard, salt and pepper."", ""Gradually whisk in the milk and whisk until smooth."", ""Bring to a boil and stir 1 minute or until as thick as you want. Remove from the heat and add the cooked sausage. This recipe doubles really well."", ""Serve over hot biscuits."", ""Jan"")"
3842,Real Fried Chicken,1859,Robb114,PT2H,PT20M,PT2H20M,1999-11-01T07:29:00Z,"There's only one right way to fry chicken and that's in a skillet, one with a tight-fitting lid.  Forget soaking chicken pieces first in milk, buttermilk, lemon  juice or vinegar and forget dipping chicken in beaten egg and then  coating it with bread, cracker or cereal crumbs.  many delicious chicken  dishes are made with lots of other seasonings and coatings, but they should not be mistaken for ""REAL"" FRIED CHICKEN",character(0),Whole Chicken,"c(""Chicken"", ""Poultry"", ""Meat"", ""High Protein"", ""High In..."", ""Potluck"", ""Spring"", ""Summer"", ""Winter"", ""Weeknight"", ""Deep Fried"", ""Stove Top"", ""< 4 Hours"")","c(""1 1/2 - 2"", ""1 1/2"", ""2"", ""1/2"", NA, NA)","c(""chicken"", ""flour"", ""salt"", ""pepper"", ""butter"", ""shortening"")",4,8,716.1,34.8,9.9,170.1,4811,47.9,1.8,0.2,48.7,,,"c(""In a shallow bowl, combine flour, salt and pepper."", ""In a large heavy skillet, combine equal portions of butter and shortening.  when butter and shortening are melted, fat should be 1/4-inch deep.  Heat until a drop  of water sizzles when it  is flipped into the hot fat."", ""Dredge chicken  pieces with seasoned flour and place in skillet; take care not to crowd the pieces."", ""Brown until chicken is the color of honey oak on one side;  then turn and brown the other side.  Brown meaty pieces first.  Allow 20  to 30 minutes to brown chicken on both sides."", 
""Cover.  Cook on low 30  minutes or until chicken is tender."", ""For crispy chicken, remove cover  and increase heat last 10 minutes of cooking time; turn chicken as necessary to prevent over-browning."", ""Note:  Chicken may  be held an additional 15-20 minutes on a rack in a 200 F. oven before  serving."")"
