RecipeId,Name,AuthorId,AuthorName,CookTime,PrepTime,TotalTime,DatePublished,Description,Images,RecipeCategory,Keywords,RecipeIngredientQuantities,RecipeIngredientParts,AggregatedRating,ReviewCount,Calories,FatContent,SaturatedFatContent,CholesterolContent,SodiumContent,CarbohydrateContent,FiberContent,SugarContent,ProteinContent,RecipeServings,RecipeYield,RecipeInstructions
3431,"Leek, Tomato, Goat Cheese Pizza",1689,Kevin Kirkland,,PT0S,PT0S,1999-10-18T03:29:00Z,"Make and share this Leek, Tomato, Goat Cheese Pizza recipe from Food.com.","""https://img.sndimg.com/food/image/upload/w_555,h_416,c_fit,fl_progressive,q_95/v1/img/recipes/34/31/piczwqSe6.jpg""",Cheese,"c(""< 15 Mins"", ""Oven"")","c(""1 1/2"", ""2"", ""1"", ""3/4"", ""3"", ""2"")","c(""butter"", ""leeks"", ""fresh parsley"", ""tomatoes"", ""feta"", ""olive oil"")",5,8,525.6,45.1,14.8,45.8,167.7,30.7,5,10.5,4.2,1,,"c(""Melt butter in large skillet over medium-low heat. Add leeks; saute until tender, about 10 minutes."", ""Season with salt and pepper."", ""Stir in parsley."", ""Cool."", ""Spread leek topping evenly over pizza shell; sprinkle tomatoes over."", ""Top with cheese.  Drizzle 1 tablespoon oil over."", ""Bake about 10 minutes at 450 F."", ""Remove from oven and brush crust with olive oil."")"
3432,Crawfish Beignets,1762,lkadlec,,PT0S,PT0S,1999-10-18T03:29:00Z,Make and share this Crawfish Beignets recipe from Food.com.,character(0),Crawfish,"c(""Cajun"", ""Creole"", ""Low Protein"", ""< 15 Mins"")","c(""2"", ""2"", ""6"", ""1"", ""1"", ""1/4"", ""1/4"", ""1"", ""1"", ""1 1/2"", ""1"", ""1/2"", NA)","c(""eggs"", ""crawfish tail meat"", ""green bell pepper"", ""green onion"", ""garlic"", ""salt"", ""flour"", ""baking powder"", ""milk"")",,,4119.3,440.5,58.1,155.5,751,39.2,1.6,0.7,15.6,4,20 beignets,"c(""In a deep-fryer heat oil over medium-high heat to 365 degrees F."", ""In a  large bowl whisk eggs until frothy."", ""Sprinkle crawfish tails with 1  tablespoon of seasoning and add to eggs."", ""Stir in bell peppers, green  onions, garlic, salt, flour, baking powder and milk; consistency will be  wet. Using a large metal tablespoon, drop beignet mixture into oil and fry  about 3 minutes or until crispy and golden brown."", ""Do this in 2 batches."", ""Using a slotted spoon remove beignets and drain thoroughly on paper  towels."", 
""Sprinkle remaining 1 teaspoon seasoning over beignets."", ""To serve,  spoon sauce onto 4 dinner plates and place 5 to 6 beignets on top of each."", ""Sprinkle rims of plates with extra seasoning."")"
3434,Chinese Boiled Chicken with Onions - Chow Yow Gai,1844,albasque,PT2H20M,PT20M,PT2H40M,1999-10-18T03:37:00Z,Make and share this Chinese Boiled Chicken with Onions - Chow Yow Gai recipe from Food.com.,character(0),Whole Chicken,"c(""Chicken"", ""Poultry"", ""Meat"", ""Chinese"", ""Asian"", ""Very Low Carbs"", ""Weeknight"", ""< 4 Hours"")","c(""1"", ""2"", ""1"", ""1"", ""2"", ""1/2"")","c(""chicken"", ""green onions"", ""light soy sauce"", ""salt"")",5,4,490.5,41.1,9.3,103.5,1045.7,3.1,1.1,1,26.7,6,,"c(""Fill a large kettle with water and bring to a boil.  (An 8-quart pot two-thirds filled with water works great for a 2 1/2 to 3-pound bird.)"", ""When the water boils, place the whole cleaned chicken into it.  When the water stops boiling, take the chicken out."", ""Cover the pot and when the water again boils, place the chicken back in the pot.  Cover the pot and turn off the heat.  Leave the chicken in the pot and the pot on the burner.  After one hour, the chicken is done.  Remove, and cool."", ""Debone the chicken and tear the meat into small strips."", 
""Place them on a large platter."", ""Clean the green onions, and split each onion down the middle.  Then cut them up into 1/2-inch pieces and place over the mound of chicken."", ""Pour the soy sauce and the sesame oil over the chicken."", ""Pour the salt over the onions."", ""When you are ready to serve, pour the hot peanut oil over onions and chicken."", ""Toss like salad and serve."")"
3435,Nuoc Mam Gung,1845,Liz29298,,PT0S,PT0S,1999-10-18T03:42:00Z,"I enclose a recipe for Nuoc Mam Gung, a Thai sauce which can be used for dipping or as a kind of salad dressing (in small amounts; it's HOT!).  At home we often have it with prawns grilled with garlic and chilis and a salad made from lettuce, finely sliced onion and coriander (cilantro in the States?).  Nuoc Mam Gung",character(0),Thai,"c(""Asian"", ""< 15 Mins"", ""Easy"")","c(""1"", ""2"", ""2"", ""2"", ""1/2"", ""2"")","c(""ginger"", ""caster sugar"", ""garlic"", ""lime"", ""nam pla"")",,,165.1,0.5,0.1,0,2789,40,2.4,31.9,4.1,,1 batch,"c(""Put the lot in a food processor and whizz until liquid."", ""Taste, and add more lime/Nam Pla if you think it needs it. Thanks, Liz Ling"")"
3436,Classic Filipino Chicken Adobo,1846,Mercedes Morgan,,PT0S,PT0S,1999-10-18T03:48:00Z,"This recipe is for the Filipino Adobo, as opposed to the Mexican Adobo sauce.  While the recipe calls for chicken, an equal amount of beef, pork or combination of the three works perfectly.","""https://img.sndimg.com/food/image/upload/w_555,h_416,c_fit,fl_progressive,q_95/v1/img/recipes/34/36/E9j2k6yjQiqDkewhShkA_15084752470231460345822.jpg""",Chicken,"c(""Poultry"", ""Meat"", ""Filipino"", ""Asian"", ""< 15 Mins"")","c(""2 1/2"", ""3 -4"", ""1/3"", ""1/4"", ""1"", ""1/3"", ""3/4"", NA, ""3 -4"", NA)","c(""chicken pieces"", ""garlic"", ""white vinegar"", ""black peppercorns"", ""bay leaf"", ""soy sauce"", ""salt"", ""potatoes"", ""water"")",4.5,26,314.3,20.8,6,103.5,1518,1.8,0.2,0.4,27.8,,,"c(""Combine all ingredients in a deep glass or stainless steel sauce pan."", ""Bring to a boil over medium heat, then reduce heat to medium low."", ""Cover and simmer for  about 30 minutes or until the meat is very tender."", ""Gently turn the meat  occasionally during the course of cooking."", ""Remove the meat from the sauce and  pan-fry in a little oil until browned on all sides."", ""Transfer to a serving  platter or bowl and cover with sauce. Serve with warm steamed rice."", ""While the recipe says to saute the meat after it's cooked, I usually brown the  meat before adding the remainder of the incredients. I have no idea what  difference this makes, if any."", 
""I adapted this from a recipe in Philippine  Recipes Made Easy, by Violeta A. Noriega."")"
3437,Hung Shao Pork,1845,Liz29298,,PT0S,PT0S,1999-10-18T03:46:00Z,"This is a traditional Chinese one-pot dish we've eaten in my family for years, which is very simple to prepare.  You can leave out the Szechuan peppercorns if you can't get hold of them.  Hung Shao Pork",character(0),Pork,"c(""Meat"", ""< 15 Mins"")","c(""1"", ""4"", ""2"", NA, ""1"", ""4"", ""1"", ""2"", ""1"", ""2"", ""1/2"", ""1"")","c(""light soy sauce"", ""tamari"", ""oyster sauce"", ""garlic"", ""cinnamon stick"", ""star anise"", ""szechuan peppercorns"", ""sugar"", ""sherry wine"", ""msg"")",,,2529.8,240.6,87.7,326.6,6180.3,35.2,1.1,27.1,54.5,1,,"c(""Stir-fry ginger and garlic in a big casserole dish."", ""Place pork in, skin down."", ""(Pluck it with tweezers first if it  bears an unhealthy resemblance to your husband's back). Add everything else and a couple of cups of water."", ""Cover and simmer over a very low heat for an hour."", ""Turn the pork over."", ""Simmer again for an hour."", ""Fish the meat out and put it in a bowl."", ""Reduce sauce a bit, taste, and add more soy/oyster sauce if you think it's needed."", ""Strain through a sieve, pour over meat and enjoy."", 
""I like to leave the meat, covered with the sauce, in the fridge for at least 24 hours before eating; the flavours intensify to a surprising extent. (It's also easier to remove fat from the top at this stage, when it's set.) Serve with rice; it's also good in sandwiches."", ""(The cold sauce turns into a delicious jelly.)"")"
3438,Corn Chowder III,1562,Libby1,,PT0S,PT0S,1999-10-18T03:46:00Z,Make and share this Corn Chowder III recipe from Food.com.,character(0),Chowders,"c(""Corn"", ""Vegetable"", ""Low Protein"", ""Low Cholesterol"", ""Healthy"", ""< 15 Mins"")","c(NA, ""1"", ""6"", ""3"", ""1/2"", ""1/2"", ""1/2"", ""1/8"", NA, ""1"")","c(""onion"", ""fresh corn kernels"", ""red bell pepper"", ""fresh rosemary"", ""dried thyme"", ""black pepper"", ""cayenne pepper"", ""fresh basil"")",,,286.1,5,1,5.4,293.8,55.7,7.3,12.8,12.6,4,,"c(""Preheat a large, heavy saucepan over medium heat for about 1 minute. Spray  it twice with the vegetable oil."", ""Saute the onion for about 5 minutes,  until translucent. Add 4 cups of the corn and saute' for 4 to 5 minutes,  until it softens a bit. Add 2 cups of the chicken stock and cook until the  corn can be mashed easily with a fork, about 20 minutes."", ""Transfer the  contents of the pan to a blender and puree until smooth."", ""Return the puree  to   the saucepan over medium-low heat. Add the bell pepper, rosemary,  thyme, black pepper, cayenne pepper, and the remaining 1 cup chicken stock  and 2 cups corn."", 
""Stir and cook for about 10 minutes more, until the  chowder is thick and creamy."", ""Garnish with the chopped basil."")"
3439,Corn Chowder (Crock Pot),1562,Libby1,PT7H,PT20M,PT7H20M,1999-10-18T03:46:00Z,Make and share this Corn Chowder (Crock Pot) recipe from Food.com.,"c(""https://img.sndimg.com/food/image/upload/w_555,h_416,c_fit,fl_progressive,q_95/v1/img/recipes/34/39/OVxnSO7TPCbjQEbgxdaK_corn-chowder-1.jpg"", ""https://img.sndimg.com/food/image/upload/w_555,h_416,c_fit,fl_progressive,q_95/v1/img/recipes/34/39/lxWKNSoqSmmu0nJfMAZv_corn-chowder-2.jpg"", ""https://img.sndimg.com/food/image/upload/w_555,h_416,c_fit,fl_progressive,q_95/v1/img/recipes/34/39/4EAInEhTeu8Or1TKKOoD_corn-chowder-4.jpg"", ""https://img.sndimg.com/food/image/upload/w_555,h_416,c_fit,fl_progressive,q_95/v1/img/recipes/34/39/picMnAq3T.jpg""
)",Chowders,"c(""Pork"", ""Potato"", ""Corn"", ""Vegetable"", ""Meat"", ""Weeknight"")","c(""6"", ""1/2"", ""2"", ""20"", ""16"", ""1"", ""1"", ""1"", ""1/4"", ""1"")","c(""bacon"", ""onion"", ""potatoes"", ""frozen whole kernel corn"", ""sugar"", ""Worcestershire sauce"", ""seasoning salt"", ""pepper"", ""water"")",5,39,353.5,7.2,2.1,8.2,449.1,71.7,7.1,8.4,9.8,4,,"c(""In skillet or microwave, fry bacon until crisp; remove and reserve."", ""Add  onion and potatoes to bacon drippings and saute' for about 5 minutes;  drain well."", ""Combine all ingredients in Crock pot. Stir well."", ""Cover and cook  on LOW setting for 6 - 7 hours."")"
3440,Potato Corn Chowder,1562,Libby1,,PT0S,PT0S,1999-10-18T03:46:00Z,Make and share this Potato Corn Chowder recipe from Food.com.,"""https://img.sndimg.com/food/image/upload/w_555,h_416,c_fit,fl_progressive,q_95/v1/img/recipes/34/40/picXB7iYh.jpg""",Chowders,"c(""Potato"", ""Corn"", ""Vegetable"", ""Low Protein"", ""< 15 Mins"")","c(""6"", ""2"", ""1"", ""1 1/2"", ""2"", ""2"", ""1 1/2"", ""2"", ""1"", ""2"")","c(""butter"", ""potatoes"", ""onion"", ""salt"", ""flour"", ""paprika"", ""water"", ""frozen whole kernel corn"", ""half-and-half"")",4,1,2366.2,183.5,113.7,541.3,5729.6,150.7,16.5,9.3,44.6,1,,"c(""Melt butter in 4 qt. saucepan."", ""Add potatoes, onion and salt ; cook until potatoes are tender, stirring often."", ""Combine flour and paprika, add to potatoes."", ""Cook 1 minute. Stirring water and bouillon."", ""Cook and stir until mixture is thick."", ""Stir in corn and half-and-half."", ""Cook, stirring frequently, until corn is tender about 15 minutes."", ""Friendly Freeze Digest 1191                    - - - - - - - - - - - - - - - - - -"")"
3441,30 Minute Smoked Sausage and Corn Chowder,1562,Libby1,PT30M,PT0S,PT30M,1999-10-18T03:46:00Z,Make and share this 30 Minute Smoked Sausage and Corn Chowder recipe from Food.com.,"c(""https://img.sndimg.com/food/image/upload/w_555,h_416,c_fit,fl_progressive,q_95/v1/img/recipes/34/41/fipC2Y7MQuuESa3yGb1G_smoked-sausage-corn-chowder-5270.jpg"", ""https://img.sndimg.com/food/image/upload/w_555,h_416,c_fit,fl_progressive,q_95/v1/img/recipes/34/41/f1wZqnjUQ6ihd4junqgc_smoked-sausage-corn-chowder-5282.jpg"", ""https://img.sndimg.com/food/image/upload/w_555,h_416,c_fit,fl_progressive,q_95/v1/img/recipes/34/41/L7b9UAsNS8aeuIdCK8Cz_smoked-sausage-corn-chowder-5259.jpg"", ""https://img.sndimg.com/food/image/upload/w_555,h_416,c_fit,fl_progressive,q_95/v1/img/recipes/34/41/QuA5DGseRiiCAfeJT1kj_smoked-sausage-corn-chowder-5276.jpg"", 
""https://img.sndimg.com/food/image/upload/w_555,h_416,c_fit,fl_progressive,q_95/v1/img/recipes/34/41/piceV6cvC.jpg"")",Chowders,"c(""Corn"", ""Vegetable"", ""< 30 Mins"")","c(""8"", ""1"", ""2"", ""2"", ""2"", ""1"", ""1/8"", ""1/2"")","c(""smoked sausage"", ""green onion"", ""vegetable broth"", ""heavy cream"")",5,36,385.5,30.7,12.8,77.5,790.8,20.5,1.8,4.3,10,4,,"c(""In large saucepan, cook onions in oil over medium heat 3-4 minutes or  until tender."", ""Stir in sausage, broth, potatoes, corn and red pepper."", ""Bring to a boil; reduce heat to low."", ""Simmer uncovered for 20 minutes."", ""Stir in cream; heat through."", ""Garnish with additional sliced green  onions, if desired."")"
3442,Cheese and Corn Chowder,1562,Libby1,,PT0S,PT0S,1999-10-18T03:46:00Z,Make and share this Cheese and Corn Chowder recipe from Food.com.,character(0),Chowders,"c(""Cheese"", ""Corn"", ""Vegetable"", ""< 15 Mins"")","c(""3"", ""2"", ""1"", ""10"", ""6"", ""1"", ""1/8"", ""3"", ""2"", ""1"")","c(""potatoes"", ""chicken bouillon granules"", ""black pepper"", ""corn"", ""American cheese"", ""water"", ""milk"", ""flour"", ""parsley"")",2.5,2,469.4,18.6,11,53.2,756,58.5,5.5,4.7,20.8,4,,"c(""In a large saucepan combine chopped potatoes, water, bouillon granules,  ground red pepper, and black pepper."", ""Bring to boilin g; reduce heat. Cover and  simmer about 10 minutes or till potatoes are just tender, stirring occasionally."", ""Stir in 2 1/2 cups of the milk and the corn."", ""In a small bowl stir together  remaining 1/2 cup milk and flour; stir into potato mixture. Cook and stir over  medium heat till slightly thickened and bubbly."", ""Cook and stir for 1 minute more. Add cheese; stir till melted."", 
""Spoon into 4 soup bowls."", ""Top each serving with  parsley."")"
3443,Sesame Chicken Cutlets,1562,Libby1,,PT0S,PT0S,1999-10-18T03:46:00Z,Make and share this Sesame Chicken Cutlets recipe from Food.com.,character(0),Chicken,"c(""Poultry"", ""Meat"", ""< 15 Mins"", ""Oven"")","c(""2"", ""1/2"", ""2"", ""1/4"", ""1/2"", ""1"", ""1"", ""1/3"", ""1/2"", ""1/4"")","c(""chicken wings"", ""soy sauce"", ""garlic"", ""black pepper"", ""Tabasco sauce"", ""ginger"", ""egg"", ""sesame seeds"", ""butter"", ""margarine"")",5,1,384.9,27.8,9.4,125.9,1199.9,7.6,1.2,0.8,25.6,8,,"c(""Cut chicken wings in half at the joint and cut off wing tips."", ""Blend next five  ingredients in processor."", ""Pour over chicken and marinate overnight. Remove  chicken from marinade. Pour egg into marinade; combine bread crumbs and sesame  seeds."", ""Dip chicken into crumb mixture; set them in a buttered baking dish."", ""Pour  melted butter over them and bake at 400F for 40 - 50 minutes."")"
3444,Tomato Sauce - Crock Pot,1534,Tonkcats,PT6H,PT20M,PT6H20M,1999-10-18T03:46:00Z,Make and share this Tomato Sauce - Crock Pot recipe from Food.com.,character(0),Sauces,"c(""Vegetable"", ""Easy"")","c(""2"", ""2"", ""1"", ""1/4"", ""1"", ""4"", ""2"", ""1"", ""2"", ""1 -2"")","c(""tomatoes"", ""tomato puree"", ""tomato paste"", ""extra virgin olive oil"", ""onion"", ""bay leaves"", ""garlic cloves"", ""dry basil"", ""seasoning salt"", ""carrot"")",5,2,1884.1,63.5,9.1,0,4647.1,323.6,76.2,189.6,65.8,,1 batch,"c(""Heat oil in sauce pan, then add onion and carrot and garlic."", ""Saute on high until transparent."", ""Add tomatoes and seasonings (basil and seasoned salt) and  add 1 can of water (or dry red wine) from the 18 ounce can that had the paste in it."", ""Place in slow cooker and cook on low all day."")"
3445,Sun-Dried Tomato Crock Pot Spaghetti Sauce,1534,Tonkcats,PT6H,PT10M,PT6H10M,1999-10-18T03:46:00Z,Make and share this Sun-Dried Tomato Crock Pot Spaghetti Sauce recipe from Food.com.,"""https://img.sndimg.com/food/image/upload/w_555,h_416,c_fit,fl_progressive,q_95/v1/img/recipes/34/45/picSK2R2E.jpg""",Sauces,"c(""European"", ""Easy"")","c(""1 1/2"", ""1"", ""1"", ""2"", ""36"", ""2/3"", ""1"", ""1 1/2"", ""1/2"", ""1/2"")","c(""sun-dried tomatoes"", ""onion"", ""celery"", ""garlic cloves"", ""whole tomatoes"", ""tomatoes"", ""other dry white wine"", ""dried fennel seed"", ""basil"", ""oregano"", ""pepper"")",4.5,6,615.5,5.3,0.8,0,1848.2,109.3,28,67.5,24,,1 batch,"c(""Salt to taste  Place all ingredients in crock pot and cook on low for 6-8 hours."", ""Note: You can add mushrooms if desired."")"
3446,Roasted Red Bell Pepper &amp; Tomato Soup,1847,Dave Newcombe,PT45M,PT20M,PT1H5M,1999-10-18T04:07:00Z,"Here is a good recipe for Roasted Red Pepper &amp; Tomato Soup, based on a dish served at the Red Devil Restaurant in Newmarket, Ontario, Canada.  Roasted Red Pepper &amp; Tomato Soup",character(0),Vegetable,"c(""Low Protein"", ""Roast"", ""Oven"", ""< 4 Hours"")","c(""2"", ""6"", ""2"", ""2"", NA, NA, ""1/4"", ""4"", ""1"")","c(""tomatoes"", ""sugar"", ""salt"", ""white pepper"", ""butter"", ""fresh basil"")",5,9,233.9,16.9,10.3,47.1,101.6,20.9,4.4,15.9,3.4,,,"c(""Grill the peppers, turning frequently, until bla ckened all over."", ""Peel off the skin."", ""Gently wipe or scrape off any remaining black stuff from the outside.  Cut open and discard seeds and white insides."", ""Do not wash as this will flush away much of the flavour."", ""Puree peppers and tomatoes in a blender or food processor."", ""Strain out seeds."", ""Place pepper/tomato mixture in a saucepan."", ""Bring to a boil, then simmer uncovered for about 25 minutes."", ""Add remaining ingredients except butter and basil."", 
""Simmer uncovered for 15 - 20 minutes."", ""Remove from heat.  Set pan in ice water and gradually whisk in butter."", ""Cool, cover and refrigerate overnight.  Next day, heat gently, garnish with basil and serve. Note: This soup is quite mild."", ""Some people might like to add a little zing, like maybe a dash of Tabasco."", ""Dave Newcombe reply:daven at primeline dot net."")"
3447,Sesame Chicken,1534,Tonkcats,,PT0S,PT0S,1999-10-18T04:07:00Z,Make and share this Sesame Chicken recipe from Food.com.,character(0),Chicken,"c(""Poultry"", ""Meat"", ""< 15 Mins"", ""Oven"")","c(""1"", ""2"", ""2"", ""1"", ""1/2"", ""4"", ""1"", ""2"")","c(""mayonnaise"", ""dry mustard"", ""sesame seeds"", ""chicken"", ""mayonnaise"", ""honey"")",,,471.9,33.3,4.9,20.4,690.5,40.9,2.4,12.2,5.5,6,,"c(""In first bowl, mix together 1 cup mayonnaise, dry  mustard and onion; set aside.  In second bowl, mix breadcrumbs and sesame seed."", ""Coat  chicken in first bowl; then in second bowl."", ""Put on baking  sheet. Bake  at 425 degrees for 12 minutes, or lightly brown."", ""Serve  with dip (1 cup mayonnaise and honey)."")"
3448,Cheesy Cincinnati Chili,1534,Tonkcats,PT2H,PT25M,PT2H25M,1999-10-17T02:24:00Z,"I love this, if you haven't tried it you need to. In Cincinnati the true enthusiasts have their Chili 1 to 5 ways: 1. Plain 2.""Two Way"" - Spaghetti & Chili 3.""Three Way"" - Chili, Spaghetti, and Cheddar Cheese 4.""Four Way"" - Chili, Spaghetti, Cheddar Cheese, and Onions 5.""Five Way"" - Chili, Spaghetti, Cheddar Cheese, Onions and Kidney  Beans","""https://img.sndimg.com/food/image/upload/w_555,h_416,c_fit,fl_progressive,q_95/v1/img/recipes/34/48/picDNLO3J.jpg""",Meat,"c(""Southwestern U.S."", ""Very Low Carbs"", ""Weeknight"", ""< 4 Hours"")","c(""2"", ""2 1/2"", ""1"", ""1 -6"", ""2"", ""1 1/2"", ""1"", ""1"", ""2"", ""5"", ""2"", ""1"", ""2"", ""1 1/2"", NA)","c(""beef"", ""water"", ""tomato paste"", ""onions"", ""vinegar"", ""Lea & Perrins Worcestershire Sauce"", ""garlic"", ""chili powder"", ""bay leaves"", ""cinnamon"", ""allspice"", ""cayenne pepper"")",4.5,24,814.1,83.7,33.9,112.4,88.5,5.6,1.9,1.9,10.2,10,,"c(""In a heavy gauge pot - heat oil, add beef until brown, add onions and water and bring to a boil."", ""Reduce to a simmer and add tomato paste and all other ingredients and let simmer 1 1/2 - 2 hours."", ""Adjust with salt & pepper to taste."", ""Remove Bay Leaves before serving."")"
3449,Marinated Bean Salad,1612,JANIC412,,PT0S,PT0S,1999-10-17T12:23:00Z,Make and share this Marinated Bean Salad recipe from Food.com.,character(0),Beans,"c(""Low Protein"", ""Low Cholesterol"", ""Healthy"", ""< 15 Mins"")","c(""1"", ""1"", ""1"", ""3 -4"", ""1"", ""1"")","c(""french-style green beans"", ""green peas"", ""green pepper"", ""celery"", ""pimiento"", ""onion"")",,,611.9,3.5,0.7,0,183.5,121.7,44.7,44.7,35.7,,1 batch,"c(""Dressing 3/4 cup salad oil 1 1/2 tsp."", ""salt 1 cup cider vinegar 1 1/2 Tbsp."", ""water 1 tsp."", ""pepper 1 1/4 cup granulated sugar Mix the drained vegetables in a glass bowl and set aside"")"
3450,Punch,1612,JANIC412,,PT0S,PT0S,1999-10-17T12:31:00Z,This is one I make for parties that can include alcohol or non-alcoholic champagne or sparkling mineral water:,character(0),Punch Beverage,"c(""Beverages"", ""Pineapple"", ""Tropical Fruits"", ""Fruit"", ""Low Protein"", ""Low Cholesterol"", ""Healthy"", ""< 15 Mins"", ""Easy"")","c(""1"", ""1"", ""3"", ""4"", NA)","""ginger ale""",5,1,578.9,0.8,0.1,0,35.3,147.5,2.5,135.8,2.3,,5 quarts,"c(""Make sure all ingredients are well chilled before mixing."", ""Mix first 3 ingredients together and right before serving, add the ginger-ale and champagne or mineral water."", ""This is also pretty with an ice ring made with juice and slices of fruit.  Makes about 5 quarts    NOTE:  Guava or passion fruit juice is a nice addition."", ""Jan"")"
3451,White Pasta Sauce,1612,JANIC412,PT5M,PT10M,PT15M,1999-10-17T12:44:00Z,Make and share this White Pasta Sauce recipe from Food.com.,character(0),< 15 Mins,,"c(""3"", ""2"", NA, NA, ""2 1/2"", NA, NA, NA)","c(""unsalted butter"", ""flour"", ""salt"", ""white pepper"", ""milk"", ""parmesan cheese"", ""shrimp"", ""fresh parsley"")",4.5,21,188.2,14.3,8.9,44.2,76,10.1,0.1,0,5.5,4,,"c(""Melt butter in a saucepan over medium heat. Whisk in flour until smooth."", ""Slowly add the milk whisking continuously until smooth."", ""Bring to a boil and boil for about 1 minute or until the sauce is as thick as you like. Add the salt, pepper and cheese. Stir."", ""Add the pre-cooked shrimp."", ""Serve over pasta."", ""You can also add any other seafood that you like to this sauce or leave it out. I have also added chicken that was sauteed in garlic and olive oil."", ""This recipe also doubles well."", 
""Sprinkle chopped parsley over to garnish. Top with extra grated parmesan cheese.  Jan."")"
3452,The Best Oatmeal Cookies Ever,1848,af8316,PT12M,PT15M,PT27M,1999-10-17T10:52:00Z,Make and share this The Best Oatmeal Cookies Ever recipe from Food.com.,character(0),Dessert,"c(""Cookie & Brownie"", ""< 30 Mins"", ""For Large Groups"", ""Oven"")","c(""1 1/2"", ""1"", ""1/2"", ""1"", ""3/4"", ""3/4"", ""1"", ""1"", ""1 1/2"", ""1"", ""1"", ""1"")","c(""flour"", ""baking soda"", ""salt"", ""butter"", ""brown sugar"", ""egg"", ""real vanilla extract"", ""oatmeal"", ""dried cherries"", ""bittersweet chocolate piece"")",,,131,6.5,3.9,17.7,97,17.1,0.8,10.8,1.4,40,40 cookies,"c(""Don't overcook!  Only bake until the outside is firm to the touch, 15 minutes max for most cookies it seems."", ""They will set as they cool on the wire rack and stay moist if you don't overcook."", ""I've yet to find a real peanut butter oatmeal cookie that isn't somewhat crisp thanks to the peanut butter."", ""And the recipe I'm listing below gets crisp but its SO GOOD you really should try it anyway --."", ""Peanut Butter Oatmeal Cookie 1 1/2 cups flour 1 tsp baking soda 1/2 tsp salt 1 cup butter 3/4 cup unrefined s ugar (turbinado or use white sugar if necessary) 3 / 4 cup brown sugar 1 egg 1 tsp real vanilla extract 1 1/2 cups oatmeal 1 cup dried cherries 1 cup bittersweet chocolate pieces 1 cup toffee pieces."", 
""Heat oven to 350°F."", ""Sift together flour and baking soda and salt. In a mixer or large bowl, cream the butter and sugars until light and fluffy."", ""Add the egg and vanilla to butter and combine. Add flour a bit at a time and combine with butter mix."", ""Fold in the oatmeal, cherries, chocolate and toffee pieces."", ""Divide dough into 3 equal portions, roll into logs with plastic wrap about 1 1/2-inches in diameter."", ""Cut logs into 3/4-inch pieces when ready to cook."", ""Bake on parchment paper covered baking sheets until golden brown, 8 to 10 minutes."", 
""Cool on wire rack. It's the cherries that make these cookies really good."", ""Use a quality chocolate bar (Ghiradellis is good domestic) that's chopped into pieces and a toffee candy bar (Skor, Heath) for the toffee pieces."", ""This can easily be made vegan if you  use dark chocolate, margarine and Ener-G egg replacer."")"
3453,Sesame Herb Chicken,1556,Strawberry Girl,,PT0S,PT0S,1999-10-17T09:23:00Z,Make and share this Sesame Herb Chicken recipe from Food.com.,character(0),Chicken,"c(""Poultry"", ""Meat"", ""< 15 Mins"", ""Oven"")","c(""1/3"", ""2"", ""3"", ""1"", ""2"", NA, ""2"")","c(""toasted sesame seeds"", ""Dijon mustard"", ""skinless chicken pieces"")",,,230.4,10.8,1.8,69,270.1,8.9,1.8,0.7,24,4,,"c(""In shallow bowl, mix breadcrumbs with sesame seeds."", ""In small bowl, mix mustard, oil, Italian seasoning, salt and pepper; spread over chicken."", ""Roll in breadcrumb mixture. Place on gre ased baking sheet. Bake in 350F oven for 40 to 45 minutes or until breast is no longer pink inside and juices run clear when legs are pieced."", ""Broil for 1 to 2 minutes to brown."", ""Or barbecue, bone side up, on preheated grill over medium heat with lid down for 25 to 35 minutes, turning once or twice."")"
