RecipeId,Name,AuthorId,AuthorName,CookTime,PrepTime,TotalTime,DatePublished,Description,Images,RecipeCategory,Keywords,RecipeIngredientQuantities,RecipeIngredientParts,AggregatedRating,ReviewCount,Calories,FatContent,SaturatedFatContent,CholesterolContent,SodiumContent,CarbohydrateContent,FiberContent,SugarContent,ProteinContent,RecipeServings,RecipeYield,RecipeInstructions
2820,Potato Cauliflower Soup,1549,Dave5003,,PT1M,PT1M,1999-08-17T05:59:00Z,Make and share this Potato Cauliflower Soup recipe from Food.com.,"""https://img.sndimg.com/food/image/upload/w_555,h_416,c_fit,fl_progressive,q_95/v1/img/recipes/28/20/picEmb9QK.jpg""",Potato,"c(""Cauliflower"", ""Vegetable"", ""< 15 Mins"")","c(""3"", ""2"", ""2"", ""1"", ""1"", ""6"", ""4"", ""4"", ""1"", ""1/4"", ""1"", ""1"", ""4"", ""1/2"")","c(""onions"", ""dried dill weed"", ""dried thyme"", ""cauliflower"", ""water"", ""potatoes"", ""bay leaves"", ""salt"", ""black pepper"", ""tamari soy sauce"", ""heavy cream"", ""white flour"", ""fresh parsley"")",5,14,257.6,16.5,7.6,40.8,458.6,24.9,4.2,3.8,4.8,8,,"c(""In a 4-quart soup pot, heat the oil and saute the onions, dill weed, and thyme until tender and beginning to brown."", ""Add cauliflower and cook a few minutes more.  Add stock or water and potatoes."", ""Cover and cook on medium heat until tender (approximately 30 minutes.) Remove from heat, and in a blender puree approximately half the soup (or 6 cups), 2 cups at a time.  Return puree to soup pot.  Simmer on lowest heat, and add bay leaves, salt, pepper, and tamari."", ""Cook approximately 20 minutes more uncovered, stirring occasionally."", 
""Mix cream with flour and stir to smooth out lumps."", ""Turn off heat and add to soup along with parsley."", ""Check seasoning."", ""Thin with water or milk if the soup has gotten too thick after sitting."", ""Reheat if necessary and serve."")"
2821,Potato Salad with Cooked Dressing,1691,I Dunno,,PT0S,PT0S,1999-09-03T14:26:00Z,Make and share this Potato Salad with Cooked Dressing recipe from Food.com.,"c(""https://img.sndimg.com/food/image/upload/w_555,h_416,c_fit,fl_progressive,q_95/v1/img/recipes/28/21/XW2R64uOS8eDqdmTHFWz_1491324261513-1527373442.jpg"", ""https://img.sndimg.com/food/image/upload/v1/img/feed/2821/CQ63h3OcRlmHbMsYKrbY_14913245808431366693471.jpg"")",Potato,"c(""Vegetable"", ""< 15 Mins"", ""Easy"")","c(""2 -3"", ""1"", ""1"", ""1/2"", ""2"", ""1/2"", ""1"", ""1/4"", ""6"", ""2"")","c(""potatoes"", ""onion"", ""celery seed"", ""mayonnaise"", ""eggs"", ""water"", ""flour"", ""sugar"", ""vinegar"", ""butter"")",5,7,1925.4,71.3,41.2,565.7,472.6,284.7,29.4,66.2,42.5,,1 batch,"c(""Mix together and let come to a boil."", ""Cook until thick."", ""Add 1/2 cup cream or you can use 1/2 cup mayonnaise.  Pour dressing over potato mixture."")"
2822,Potato-Crusted Meatloaf,1552,Ron  Joyce Ripple S,PT1H,PT20M,PT1H20M,1999-09-12T06:26:00Z,I have had this recipe for a long time and do not know where I got it other than it was from a magazine.,"""https://img.sndimg.com/food/image/upload/w_555,h_416,c_fit,fl_progressive,q_95/v1/img/recipes/28/22/picstPPHm.jpg""",Potato,"c(""Vegetable"", ""Meat"", ""Asian"", ""Oven"", ""< 4 Hours"")","c(""1"", ""1"", ""1"", ""3"", ""1"", ""1"", ""1/4"", ""1/2"", ""1"", ""1 1/2"", ""1/2"", ""1"", ""1/4"", ""2"")","c(""yellow onion"", ""green bell pepper"", ""red bell pepper"", ""garlic cloves"", ""ground beef"", ""egg substitute"", ""egg"", ""bottled chili sauce"", ""fat free cheese"", ""black pepper"", ""russet baking potatoes"", ""chives"")",4,1,665.2,27.3,10.4,170.6,1479.2,50.2,6.3,7.5,53,,,"c(""Preheat the broiler."", ""Place the onion, bell peppers and garlic cloves on a baking sheet.  Broil 3 inches from heat for 7 minutes or until blackened, turning frequently."", ""Transfer to a paper bag, close tightly and let stand 15 minutes or until soft.  Scrape off outside skins."", ""Chop the onion and garlic; seed and chop the peppers."", ""(You will have about 2 cups of vegetables). Preheat oven to 350 and spray a 13x9x3\"" baking dish with nonstick cooking spray."", ""In a large bowl, mix the beef, veal, vegetables, egg, chili sauce, bread crumbs, 1/2 cup of the cheese and the black pepper."", 
""Mix with your hand until well combined."", ""Transfer to the baking dish and pat into a 12x7\"" loaf, mounding it slightly in the center."", ""In a small bowl, with an electric mixer set on med.-high, whip the hot potatoes with the remaining 1 cup of cheese, the chives and the butter until fluffy."", ""Pipe or spoon on top and sides of the loaf."", ""Bake for 1 hour or until a meat thermometer inserted into the center of the meat loaf registers 145."", ""Let stand for 10 minutes before serving."")"
2823,Potato-Stuffed Green Bell Peppers,1533,Dancer,PT25M,PT40M,PT1H5M,1999-08-10T18:23:00Z,Make and share this Potato-Stuffed Green Bell Peppers recipe from Food.com.,character(0),Potato,"c(""Peppers"", ""Vegetable"", ""Lactose Free"", ""Vegan"", ""Egg Free"", ""Kosher"", ""Free Of..."", ""Oven"", ""< 4 Hours"")","c(""4"", ""1/2"", ""1/2"", NA, ""1"", ""2"", ""2"")","c(""green bell peppers"", ""onion"", ""dried chives"", ""potatoes"", ""tomato sauce"")",5,3,143.2,0.7,0.2,0,652.3,32.9,6.9,11.4,4.9,4,,"c(""Preheat oven to 350 degrees."", ""Slice away pepper tops below stems."", ""Remove seeds and interior spines."", ""Gently parboil peppers about 5 minutes."", ""Drain upside down."", ""Set peppers aside. Saute onions and red pepper until soft. Add seasonings and mix well into mashed potatoes."", ""Carefully stuff peppers, set them in a deep- sided baking dish."", ""Pour tomato sauce around base of peppers."", ""Bake at 350 degrees for about 20 minutes covered."", ""Uncover, and bake 5 minutes longer."", ""Serve warm.""
)"
2824,Pound Cake Supreme,1692,MP562,,PT0S,PT0S,1999-09-16T20:59:00Z,Make and share this Pound Cake Supreme recipe from Food.com.,character(0),Dessert,"c(""< 15 Mins"", ""Easy"")","c(""1"", ""1"", ""1"", ""1"")","c(""cherry pie filling"", ""Cool Whip"")",,,1851.2,54.1,14.1,174,1307.1,324.1,6.6,0,17.8,1,,"c(""Split cake into 3 layers."", ""Put 1/2 can of blueberry pie filling on first layer and put cherry pie filling on second layer."", ""Cover entire dessert with thawed cool whip."", ""You may make a small indentation in the cool whip on top and add a few cherries."", ""Service with the leftover pie fillings."")"
2825,Praline Pudding Cake,1693,LdySara108,PT35M,PT0S,PT35M,1999-09-06T18:35:00Z,Make and share this Praline Pudding Cake recipe from Food.com.,character(0),Dessert,"c(""Low Protein"", ""Low Cholesterol"", ""Healthy"", ""< 60 Mins"", ""Oven"")","c(""3/4"", ""1 1/4"", ""1"", ""3/4"", ""1/3"", ""1"", ""1/4"", ""1/2"", ""2"", ""1 1/2"", ""1 3/4"", NA, NA)","c(""brown sugar"", ""all-purpose flour"", ""all-purpose flour"", ""granulated sugar"", ""pecans"", ""baking powder"", ""salt"", ""low-fat milk"", ""butter"", ""margarine"", ""vanilla"", ""boiling water"", ""pecans"")",5,1,259.4,5.8,2,7.5,221.2,50.2,0.9,35.4,2.8,9,,"c(""Preheat oven to 350 degrees."", ""Combine brown sugar and 1 tablespoon flour in a bowl, mix and set aside.  Combine 1 1/4 cups flour with the granulated sugar, pecans, baking powder and salt in a bowl, make well in the center."", ""Combine milk, margarine, and vanilla and add to flour mixture, stir until moist. Spread batter into an 8 inch square baking pan, sprinkle top with brown sugar mixture.  Pour boiling water over batter, do not stir."", ""Bake at 350 for 35 minutes or until pudding is bubbly and cake springs back when lightly touched in center."", 
""Serve warm with whipped cream topping."", ""Garnish with pecans if desired."", ""I made this cake this past weekend, it is not too heavy as I got it from Cooking Light Magazine."")"
2826,Prawns (Shrimp) on the Barbie Aussie Style,1694,MaxinePeter,,PT0S,PT0S,1999-09-05T19:49:00Z,Make and share this Prawns (Shrimp) on the Barbie Aussie Style recipe from Food.com.,"""https://img.sndimg.com/food/image/upload/w_555,h_416,c_fit,fl_progressive,q_95/v1/img/recipes/28/26/picPapF9B.jpg""",Very Low Carbs,"c(""High Protein"", ""High In..."", ""< 15 Mins"")","c(""2"", ""750"", ""2"", ""1"", ""1"", ""1"")","c(""garlic"", ""fresh ginger"", ""fresh coriander"")",5,1,233.2,9.6,1.4,242.5,243.3,2.2,0.1,0,32.6,4,,"c(""These are prepared using a kettle bbq, with a direct fire, the lid off, and"", ""using the wok."", ""Heat the wok and add the oil."", ""Fry the prawns with the garlic,  ginger and chilli, tossing them well until the prawns turn pink and are cooked  through."", ""Add the coriander and serve the prawns as an entree."")"
2827,Prize Winning Zucchini Relish,1535,Marg CaymanDesigns,,PT0S,PT0S,1999-09-14T04:41:00Z,Make and share this Prize Winning Zucchini Relish recipe from Food.com.,character(0),Vegetable,"""< 15 Mins""","c(""10"", ""4"", ""1"", ""1"", ""3"", ""3 1/2"", ""3"", ""1"", ""4"", ""1"", ""1/2"")","c(""zucchini"", ""onions"", ""green chilies"", ""canning salt"", ""sugar"", ""vinegar"", ""turmeric"", ""celery seeds"", ""pepper"", ""nutmeg"")",5,5,693.6,1.7,0.4,0,4221.2,165.8,6.3,154.1,5.7,,5 pints.,"c(""In a large container, combine zucchini, onion, pepper, chilies and salt; stir well."", ""Chill overnight. Rinse thoroughly; drain."", ""In a large kettle, combine remaining ingredients; bring to a boil."", ""Add zucchini mixture; simmer for 10 minutes."", ""Ladle hot into hot jars, leaving 1/4-inch  headspace. Adjust lids."", ""Process for 10 minutes in a boiling-water bath."", ""Serving suggestion: Mix into tuna or macaroni salad."", ""(Country Woman July/Aug 1995)"")"
2828,Queen's Speech Peach Trifle,1556,Strawberry Girl,,PT0S,PT0S,1999-08-14T19:37:00Z,Make and share this Queen's Speech Peach Trifle recipe from Food.com.,character(0),Dessert,"c(""Fruit"", ""< 15 Mins"")","c(""1"", ""1"", ""2"", ""1/3"", ""1"", ""4 1/2"", ""1"", NA)","c(""low-fat vanilla yogurt"", ""non-fat vanilla yogurt"", ""vanilla pudding mix"", ""skim milk"", ""dry sherry"", ""mint sprig"")",4,1,1302.8,4.9,2.9,22.1,1553.1,268.4,2,198,32.4,1,,"c(""Pour the yogurt into a coffee filter set in a colander over a bowl and let drain for 5 to 10 minutes."", ""In a large bowl, whisk together the pudding mix and milk  until well blended."", ""Add the drained yogurt and stir to combine. Set aside.  In a small bowl, mix the jam and sherry."", ""Set aside.  In a large deep glass bowl,  arrange half of the cake cubes."", ""Spread half of the pudding mixture over them."", ""Spoon half the jam mixture over the pudding, and top with half the peaches."", ""Repeat layers in the same order with remaining ingredients."", 
""Granish with the  reserved peach slices and mint.  For a change, this trifle is also delicious when made with a 15 ounce (425g)  package of frozen unsweetened raspberries, sweetened with 1 tbsp granulated  sugar, instead of the peaches."")"
2829,Quick and Cheap Pasta,1696,Hugo Soares,,PT0S,PT0S,1999-08-15T07:36:00Z,Make and share this Quick and Cheap Pasta recipe from Food.com.,character(0),< 15 Mins,"""Easy""","c(""1"", NA, NA, ""1/2"", ""4 -5"", ""1/2"", NA, NA, NA, NA, NA)","c(""butter"", ""spaghetti"", ""desired pasta"", ""olive oil"", ""onion"", ""tomato paste"", ""water"", ""salt"", ""pepper"", ""nutmeg"", ""mustard"", ""lemon juice"")",4,1,176.5,11.9,7.4,30.5,614.5,17.3,3.6,10.2,3.5,1,,"c(""Have some boiling water, with salt and one of those chicken  stock cubes in it and a tablespoon of butter."", ""When it starts to boil, add the  Spaghetti or any other type of pasta."", ""After about 10-15 minutes, the pasta  should be cooked (try it and see if its not hard) Remove the water, stir a  little bit with a fork (don't squish it!) and let it dry for about one minute.   You can eat the pasta like this it's good, but you'll be fed up with it in no  time, so, the solution I found is to add some nice sauce: Start making the sauce about 5 minutes after the pasta's been boiling Have some  oil or olive oil on a frying pan or a small pan."", 
""Add half an onion cut into  little pieces."", ""When the onion starts to get transparent and soft add a little  bit of concentrated tomato, just about 4-5 table spoons."", ""Stir (have the fire set to LOW) Add half a cup of water and stir again."", ""Add salt, pepper, nutmeg,  mustard, lemon juice, and any sort of seasoning you like, and let it cook for a  couple of minutes."", ""And there, you have your basic sauce recipe, if you're vegan, just pour it over  the pasta, it's very tasty."", ""If you're not vegan you'll soon get fed up with this to, to solve that problem, simply add whatever you want to the sauce, it's  excellent with canned tuna, mushrooms, fish leftovers, meat, ham, really  ANYTHING you like! And the great thing is that the sauce has a completely  different taste depending on what you add to it. I hope this helps :)""
)"
2830,Quick Applesauce Crisp,1545,Nancy Van Ess,PT35M,PT15M,PT50M,1999-08-24T04:40:00Z,Make and share this Quick Applesauce Crisp recipe from Food.com.,character(0),Dessert,"c(""Low Protein"", ""Low Cholesterol"", ""Healthy"", ""< 60 Mins"", ""Oven"")","c(""2"", ""1/2"", ""1/4"", ""1/2"", ""1"", ""1/3"", ""3"", ""1/4"")","c(""applesauce"", ""brown sugar"", ""raisins"", ""cinnamon"", ""Bisquick baking mix"", ""sugar"", ""firm margarine"")",5,2,548.1,17.8,3.5,0.6,587.3,97.5,3.4,52.4,4.5,4,,"c(""Preheat oven to 375 degrees."", ""Mix applesauce, brown sugar, raisins, and cinnamon in ungreased round pan, 9x1 1/2\""."", ""Heat in oven for 15 minutes."", ""Mix baking mix, sugar, and margarine until crumbly; stir in nuts."", ""Sprinkle evenly over applesauce mixture. Bake until golden brown, about 25 minutes."")"
2831,Quick Keema Beef Curry,1697,Alan1,PT1H,PT20M,PT1H20M,1999-09-20T20:06:00Z,Make and share this Quick Keema Beef Curry recipe from Food.com.,character(0),< 4 Hours,,"c(""4"", ""1"", ""1"", ""1"", ""2"", ""1 1/2"", ""1"", ""1/2"", ""6"", ""2"", ""2"", ""1/2"")","c(""onion"", ""garlic clove"", ""salt"", ""ginger"", ""beef"", ""garam masala"", ""hot chili powder"", ""tomatoes"", ""tomato puree"", ""unsweetened plain yogurt"")",5,2,1370.7,137.3,53.6,178.5,679.7,16,3.3,10.4,19,4,,"c(""Heat 2 tablespoons of oil in pan and fry mince to remove most of the fat, drain  when complete and put to one side ready for the next stage.  Heat remaining oil  in a large pan."", ""Add onions, garlic, ginger and salt and fry  until golden."", ""Add  meat, tomatoes, garam masala, chilli powder, tomato puree, one carton of yogurt  and some of the stock to make a dry mixture then simmer for about 1/2 hour or  until meat is tender check regularly if mixture is getting to dry add more  stock, try to aim for a moist curry not sloppy."", 
""When you are ready to serve mix  in the rest of the yogurt and serve with rice  and a sweet chutney."", ""You may like some garlic bread or papadams with it also."", ""A Favorite with some of my friends Alan."")"
2832,Rainbow Ice Creams,1646,WildlifeDi,,PT0S,PT0S,1999-08-22T04:54:00Z,I have a recipe to make sherbets which we love.  It is light and flavorful as  well as pretty and inviting!  Give it a try       Rainbow Ice Creams,character(0),Frozen Desserts,"c(""Dessert"", ""Free Of..."", ""< 15 Mins"")","c(""1"", ""1/2"", ""1"", ""2"", ""2"", ""1"")","c(""fruit flavored gelatin"", ""boiling water"", ""half and half milk"")",,,4691.3,325.4,202.2,1153.3,1304.6,353.7,0,231.9,112.1,1,,"c(""In a large bowl, dissolve the gelatin in boiling water."", ""Stir in remaining  ingredients."", ""Freeze in ice trays or according to your ice cream freezers  instructions."", ""FLAVOR SUGGESTIONS Lime   add 2 tablespoons of fresh lime juice or concentrate Lemon   add 1 tablespoons grated lemon rind, fresh only Orange   add 1 tablespoon orange rind, fresh only"")"
2834,Raisin Pie,1556,Strawberry Girl,,PT0S,PT0S,1999-08-14T19:25:00Z,Make and share this Raisin Pie recipe from Food.com.,character(0),Pie,"c(""Dessert"", ""Fruit"", ""Low Protein"", ""Low Cholesterol"", ""Healthy"", ""< 15 Mins"", ""Oven"")","c(""2 1/2"", ""1 1/2"", ""1/4"", ""3"", ""2"", ""1/3"", ""1"", NA)","c(""seedless sultana raisins"", ""water"", ""brown sugar"", ""cornstarch"", ""vinegar"", ""orange"", ""evaporated milk"")",,,239.2,2.6,1.5,9.1,42.8,54.5,2,38.1,3.8,8,,"c(""Wash raisins, add the water and simmer for 10 minutes."", ""Add the brown sugar."", ""Moisten the cornstarch with vinegar and orange juice (and a little water if  using a chopped orange). Stir into the raisin mixture and cook until thick."", ""Add  the milk."", ""Roll out half the pastry to line an 8-inch pie plate. Fill with the  raisin mixture. Cover with the other half of the pastry."", ""Make three or four  slits in the top crust. Bake at 400 F for 35 to 45 minutes."")"
2835,Raisin Sour Cream Pie,1752,Bob Ross,,PT0S,PT0S,1999-08-11T04:46:00Z,Make and share this Raisin Sour Cream Pie recipe from Food.com.,character(0),Pie,"c(""Dessert"", ""< 15 Mins"", ""Oven"")","c(""3"", ""1"", ""1"", ""1/4"", ""1/4"", ""1/2"", ""1"", ""1"")","c(""eggs"", ""sugar"", ""sour cream"", ""nutmeg"", ""clove"", ""cinnamon"", ""raisins"")",4.5,4,2837.9,123.9,49.8,735.7,1284.7,409.4,12.9,287.7,41.8,1,,"c(""Preheat oven to 350."", ""Beat yolks till light; add sugar, spices and sour cream."", ""Dust raisins lightly with flour and add to egg mixture.Pour into pie shell and bake until set (approx."", ""45 minutes). Make a meringue using the 3 egg whites and add a dash of cinnamon to it. Cover pie and brown."", ""Enjoy...."")"
2836,Ranch Dressing Mix Plus,1545,Nancy Van Ess,,PT5M,PT5M,1999-09-03T12:56:00Z,Make and share this Ranch Dressing Mix Plus recipe from Food.com.,character(0),< 15 Mins,,"c(""1"", ""1/2"", ""1/2"", ""1/2"", ""1/2"", ""1/4"", ""1/4"", ""2"", ""2"", ""2"", ""1/4"", ""2"", ""1"", ""1"")","c(""dried parsley flakes"", ""garlic powder"", ""onion powder"", ""dill weed"", ""mayonnaise"", ""buttermilk"", ""chili sauce"", ""cucumber"", ""celery seed"")",5,3,795,42.2,6.8,35.5,1416.3,96,9.9,24,16.3,,4 cups,"c(""In a large mixing bowl, combine first 8 ingredients; mix well."", ""Store in airtight container in a cool dry place. YIELD: 3 cups mix (enough to make 24 batches of  ranch salad dressing).  For Ranch Salad Dressing: In a bowl, whisk together 2  tablespoons of mix with mayonnaise and buttermilk."", ""Refrigerate until serving."", ""For Thousand Island Dressing: Add chili sauce and pickle relish to 1 cup  prepared ranch dressing."", ""For Cucumber Dressing: Add cucumber and celery seed to 1 cup of prepared ranch  salad dressing.""
)"
2837,Beef and Bean Burritos II,1777,Brewer,,PT0S,PT0S,1999-08-21T11:10:00Z,Make and share this Beef and Bean Burritos II recipe from Food.com.,character(0),Beans,"c(""Meat"", ""Mexican"", ""< 15 Mins"", ""Oven"", ""Easy"")","c(""1"", ""1"", ""1 -2"", ""1/4"", ""1"")","c(""salsa"", ""water"")",,,1751.5,63.5,27.9,633.6,2864.4,71.6,22.9,2.5,227.1,1,,"c(""Place chuck roast in crockpot and add burrito mix and water."", ""Turn the roast a few times and swish it around to blend in the mix."", ""Add the salsa, cover and cook on low 12 to 14 hours or until the meat is falling apart. Wrap flour tortillas in foil and warm in a 325% oven for 10 to 15 minutes."", ""While tortillas are warming heat up beans."", ""On the middle of the tortillas from place some of the meat, some beans and some grated cheddar cheese if desired."", ""You want to leave about 1/2 inch at the top and the bottom and have the mixture go out to the sides about a couple of inches."", 
""Fold over the top and the bottom and then fold one said then the other."", ""I add grated cheddar cheese to the beans during the last couple of minutes of heating them up as well as adding beans to my burritos."", ""Oh and I like mine hotter then the rest of the family so I add extra salsa to mine before rolling up."", ""Simple bean and cheese burritos can be made using can beans and grated cheese.."", ""Heat beans, heat tortillas and put together as above."")"
2839,Red Candied Apples,1551,Sean Coate,,PT0S,PT0S,1999-09-15T06:25:00Z,Make and share this Red Candied Apples recipe from Food.com.,character(0),Dessert,"c(""Lunch/Snacks"", ""Apple"", ""Fruit"", ""Low Protein"", ""Low Cholesterol"", ""Healthy"", ""Microwave"", ""< 15 Mins"")","c(""8 -10"", ""2"", ""3/4"", ""1/2"", ""1/2"", ""3 -5"")","c(""crisp red apples"", ""sugar"", ""water"", ""light corn syrup"")",5,1,348.4,0.3,0.1,0,16.2,91.5,4.4,74.5,0.5,8,,"c(""Butter cookie sheet generously."", ""Wash and dry waxed apples thoroughly."", ""Insert  wooden skewer in stem end of each apple. Mix sugar, water, corn  syrup  and food color in 2-quart heavy saucepan."", ""Heat to boiling over high heat;  reduce  heat.  Boil gently, without stirring, to 290 on candy thermometer or until  small  amount  of mixture dropped into very cold water separates into threads that are  hard but  not brittle. Stir in clove oil."", ""Dip apples quickly into syrup,  twirling  until completely coated."", 
""Stand on cookie sheet; cool."", ""MICROWAVE DIRECTIONS:  Mix sugar, water, corn syrup and food color in 1  1/2-quart glass  casserole.  Microwave uncovered on high 19 to 23 minutes,  stirring once after 5  minutes, to 290 on microwave candy thermometer or until  small amount of mixture  dropped  into very cold water separates into threads  that are hard but not  brittle. Stir in clove oil."", ""Dip apples quickly into  syrup."", ""Continue as directed."", ""NOTES : Pour any remaining syrup onto buttered cookie sheet. Cool; break  into small pieces for a treat.""
)"
2840,Refrigerator Potato Rolls,1559,Will Parkinson,PT25M,PT1H10M,PT1H35M,1999-09-13T15:47:00Z,Make and share this Refrigerator Potato Rolls recipe from Food.com.,character(0),Potato,"c(""Vegetable"", ""Healthy"", ""For Large Groups"", ""Oven"", ""Refrigerator"", ""< 4 Hours"")","c(""2"", ""4 1/2 - 4 3/4"", ""1/4"", ""1"", ""1/2"", ""1/2"", ""1"", ""2"")","c(""potatoes"", ""flour"", ""dry yeast"", ""milk"", ""shortening"", ""sugar"", ""salt"", ""eggs"")",5,1,132.2,4,1.1,14.3,82.6,21,1,3.4,3,32,32 rolls,"c(""In large mixing bowl thoroughly mix 2 cups flour and yeast.  In pan heat milk, shortening, sugar and salt until warm (115 - 120 degrees).  Stir in potatoes."", ""Add to dry mixture in bowl."", ""Add eggs."", ""Beat at low speed for 1/2 minute.  Beat 3 minutes at high speed."", ""By hand stir in enough remaining flour to make a soft dough."", ""Place dough in greased bowl; turn once to grease surface. Cover and refrigerate several hours or up to 1 week."", ""To use dough, grease 13 x 9-inch pan."", ""Makes 32 rolls."", 
""Cover and let rise about 45-60 minutes."", ""Bake at 375 for 25 - 30 minutes."")"
2841,Rhubarb Glazed Pork Roast,1530,Carole Reu,PT1H30M,PT0S,PT1H30M,1999-08-27T04:51:00Z,Make and share this Rhubarb Glazed Pork Roast recipe from Food.com.,character(0),Pork,"c(""Meat"", ""Weeknight"", ""Roast"", ""Oven"", ""< 4 Hours"")","c(""2 1/2"", ""4"", ""0.5"", ""2"", ""2"", ""1/3"", ""2"", ""1"")","c(""boneless pork top loin"", ""rhubarb"", ""cornstarch"", ""water"", ""honey"", ""dijon-style mustard"", ""wine vinegar"")",5,6,152.9,4.1,1.4,38.7,31,16.2,1.1,12.3,13.1,8,,"c(""Place roast on a rack in a shallow roasting pan."", ""Roast in 325 oven for 1 1/4  hours to 1 3/4 hours or until fork tender."", ""For glaze:  In a 2 quart sauce pan combine rhubarb and cranberry juice.  Bring  to boiling; reduce heat.  Cover and simmer 15 minutes or till rhubarb is very  tender."", ""Strain mixture into a 2 cup liquid measure pressing out liquid with the back of a spoon."", ""Add enough water to equal 1 1/4 cup."", ""Discard pulp."", ""In the same saucepan stir together cornstarch and 2 Tbsp water."", 
""Stir in rhubarb liquid."", ""Cook and stir over medium heat until thickened and bubbly."", ""Cook and  stir for 2 minutes more.  Stir in honey, mustard and vinegar."", ""Heat through."", ""Brush some of the glaze onto the meat for the last 30 minutes of roasting."", ""Cover meat with foil; let stand 15 minutes before carving."", ""Heat remaining  glaze; serve with meat."")"
2842,Rice with Lemongrass and Green Onion,1554,Jacques Lorrain,,PT0S,PT0S,1999-09-04T20:58:00Z,Make and share this Rice with Lemongrass and Green Onion recipe from Food.com.,character(0),White Rice,"c(""Long Grain Rice"", ""Rice"", ""Vegan"", ""< 15 Mins"")","c(""2"", ""2/3"", ""1/4"", ""1"", ""1 3/4"", ""2"", ""1/2"", ""1"")","c(""onion"", ""turmeric"", ""long grain white rice"", ""water"", ""lemongrass"", ""salt"", ""green onion"")",3.5,2,242.1,7.2,1,0,298.2,40,1.2,1.3,3.7,4,,"c(""Heat 1 1/2 Tbsp oil in heavy medium saucepan over medium heat."", ""Add 2/3 cup onion and turmeric and saute 5 minutes."", ""Mix in rice. Add water lemon grass and 1/2 tsp salt and bring to simmer."", ""Cover, reduce heat to medium low and simmer until rice is tender and liquid is absorbed, about 18 minutes."", ""Remove from heat; let stand covered 10 minutes."", ""Discard lemon grass."", ""Heat remaining 1/2 Tbsp oil in heavy large skillet over medium heat. Add green onion and saute 1 minute. Add rice and stir until heated through."", 
""Season to taste with salt."")"
