RecipeId,Name,AuthorId,AuthorName,CookTime,PrepTime,TotalTime,DatePublished,Description,Images,RecipeCategory,Keywords,RecipeIngredientQuantities,RecipeIngredientParts,AggregatedRating,ReviewCount,Calories,FatContent,SaturatedFatContent,CholesterolContent,SodiumContent,CarbohydrateContent,FiberContent,SugarContent,ProteinContent,RecipeServings,RecipeYield,RecipeInstructions
3695,Roast Prime Rib of Beef,1796,Frank Butcher,PT3H,PT25M,PT3H25M,1999-11-10T01:13:00Z,Make and share this Roast Prime Rib of Beef recipe from Food.com.,character(0),Meat,"c(""Very Low Carbs"", ""High Protein"", ""High In..."", ""Roast"", ""For Large Groups"", ""Oven"", ""< 4 Hours"", ""Easy"")","c(""1 -10"", NA, ""1"", NA)","""beef broth""",3,1,48.3,3.9,1.6,11.9,31.8,0,0,0,3.1,26,,"c(""Have your butcher trim the short ribs from the roast. Place the meat in a dish  and let it come to room temperature. Rub all sides with salt and pepper."", ""Place  the meat on a rack in a shallow roasting pan."", ""Roast in a preheated 450 degree F  oven for 25 minutes."", ""Reduce the heat to 325 degree F and roast 2 hours longer  for medium-rare. Transfer the roast to a heated platter."", ""Cover loosely and let  stand for 15 minutes before carving."", ""For the Au Jus:  Spoon off any excess fat from the roasting pan."", 
""Measure out 1/2 cup of the beef  juices and reserve for the Yorkshire pudding."", ""Pour the beef broth into the  roasting pan."", ""Bring to a simmer over moderately high heat, scraping up any brown  bits clinging to the bottom and sides of the pan."", ""Season with salt and pepper."", ""Strain the roasting juices into a heated sauce boat and serve with the roast."")"
3696,Roast Onions,1796,Frank Butcher,,PT0S,PT0S,1999-11-10T01:13:00Z,Make and share this Roast Onions recipe from Food.com.,character(0),Onions,"c(""Vegetable"", ""Low Protein"", ""Low Cholesterol"", ""Healthy"", ""Roast"", ""< 15 Mins"", ""Oven"", ""Easy"")","c(""3"", ""10"", NA)","c(""butter"", ""yellow onions"")",4,1,767.4,35.4,22.2,91.6,278.4,111.2,15.4,47.1,10.5,1,,"c(""Heat the butter in a large heavy skillet until it is foaming."", ""Add the onion quarters in quantities that fit easily in the pan."", ""Toss the onions over moderate heat until well coated on all sides."", ""Transfer to a shallow baking dish."", ""Sprinkle the onions with salt and  pepper."", ""Bake in a preheated 350 degree F oven for 1  hour and 15 minutes, turning the onion every 20 minutes during roasting."")"
3697,Yorkshire Pudding II,1796,Frank Butcher,PT2H,PT0S,PT2H,1999-11-10T01:13:00Z,Make and share this Yorkshire Pudding II recipe from Food.com.,character(0),European,"c(""Weeknight"", ""Oven"", ""< 4 Hours"")","c(""3 3/4"", ""1"", ""1 1/4"", ""3/4"", ""4"", ""1/2"")","c(""all-purpose flour"", ""salt"", ""milk"", ""water"", ""eggs"")",,,2187.4,34.8,13.9,786.7,2773.6,373.3,12.7,2,83.5,,1 batch,"c(""Sift together the flour and the salt in a large mixing bowl."", ""Add the milk, water  and eggs."", ""Beat the mixture until smooth."", ""Cover the bowl and let stand at room  temperature for 2 hours."", ""Pour the beef drippings into a shallow 10x15-inch  baking dish."", ""Place in a preheated 450 degree F oven for 10 minutes."", ""Stir the  batter again and pour into the baking dish."", ""Bake 15 minutes."", ""Reduce the heat to  350 degree F and bake 20 to 30 minutes, until the pudding is puffed and golden.""
)"
3698,Creamed Spinach with Croutons,1796,Frank Butcher,,PT0S,PT0S,1999-11-10T01:13:00Z,Make and share this Creamed Spinach with Croutons recipe from Food.com.,character(0),Vegetable,"c(""European"", ""Roast"", ""< 15 Mins"", ""Oven"")","c(""3"", NA, NA, NA, ""1 1/2"", ""1"", ""1"", ""2"", ""1 -2"")","c(""fresh spinach"", ""water"", ""nutmeg"", ""flour"", ""heavy cream"", ""butter"")",,,1444.1,114,66.1,734.2,1434.3,78.8,30.9,7.3,52,,1 batch,"c(""Wash the spinach in cold water; drain."", ""Drop into a kettle of boiling salted  water."", ""Return the water to a boil."", ""Cook slowly, uncovered, for 5 minutes."", ""Drain  the spinach in a colander."", ""Immediately rinse under cold running water for 1  minute. Squeeze the spinach, a handful at a time, to extract as much water as  possible. Chop very fine. Heat the butter until bubbling in a saucepan over  moderately high heat. Stir in  the spinach."", ""Continue stirring for 2 to 3 minutes  until all moisture has evaporated."", 
""Season with salt, pepper and nutmeg."", ""Lower  the heat to moderate. Sprinkle on the flour and cook, stirring for 2 minutes."", ""Remove the pan from the heat. Add the cream by spoonfuls while stirring until  2/3 cup has been added."", ""Return to the heat and bring to a simmer."", ""Cover and cook  very slowly for 15 minutes, stirring occasionally and adding the remaining 1/3  cup cream by spoonfuls."", ""Remove the spinach from the heat. Stir in the butter (1  Tbsp). Transfer the creamed spinach to a deep serving dish and mound it  decoratively with a spatula."", 
""Garnish the spinach with sieved egg yolks and  croutons."", ""For the Croutons:  Cut decorative shapes out of the bread using a Christmas cookie cutter."", ""Toast  the bread under the preheated broiler."", ""Place around the spinach for garnish."")"
3699,Christmas Trifle,1796,Frank Butcher,,PT0S,PT0S,1999-11-10T01:13:00Z,Make and share this Christmas Trifle recipe from Food.com.,character(0),Christmas,"c(""< 15 Mins"", ""Oven"")","c(""2"", ""6"", ""1/2"", ""1"", ""6"", ""1"", ""1/2"", ""8"", ""12"", ""1/2"", ""12"", ""1/2"", ""2"", ""2"", ""1"", ""1"", ""2"", ""2"", NA, NA, NA)","c(""flour"", ""sugar"", ""vanilla"", ""salt"", ""flour"", ""brandy"", ""sugar"", ""milk"", ""vanilla"", ""sugar"", ""brandy"", ""maraschino cherry"", ""angelica leaf"")",,,5730.2,327.9,184.8,4323.4,1179.7,498.4,4.3,345.9,104.9,,1 trifle,"c(""Butter the bottom and sides of an 11x16-inch jelly roll pan and an 8-inch square cake pan.  Line with waxed paper. Butter the paper  and dust lightly with the flour."", ""Set the pans aside. Beat the egg yolks, sugar  and vanilla with an electric mixer until the mixture is light and ribbons when the beater is lifted."", ""Beat the egg whites and the salt until they hold stiff  peaks."", ""Fold one-fourth of the eggs whites into the yolk mixture. Pour the yolk mixture on top of the remaining egg whites and sprinkle on the 1/2 cup flour."", 
""Fold the mixture together."", ""Pour into the prepared jelly roll pan and 1-inch deep  into the prepared cake pan."", ""Bake in a preheated 350 degree F oven for 15 minutes  or until lightly browned."", ""Invert the cake onto a rack or baking sheet to cool.  Peel off the waxed paper."", ""Split the 11x16-inch cake in half crosswise. Spread  one half with some of the raspberry jelly."", ""Top with the other half of the cake.  Cut the layered cake into triangles."", ""Line the bottom of an 1-1/2 quart glass serving bowl with the sandwiched triangles."", 
""Line the sides of the  bowl with the triangles alternately pointing up, then down, leaving about  1/3-inch between each triangle. Fill the spaces with the remaining raspberry  jelly."", ""Cut the 8-inch square cake into small pieces and sprinkle inside the bowl  al  ong with the macaroons."", ""Sprinkle with the brandy."", ""Beat the egg yolks and sugar in a large bowl until the mixture is light and  ribbons when the beater is lifted. Pour on the milk and cream in a stream while beating."", ""Transfer the mixture to a heavy saucepan. Cook over low heat, stirring, until thickened. Do not let it boil."", 
""Remove from the heat and stir in the  vanilla."", ""Pour the hot custard into a metal bowl."", ""Place the bowl in a larger bowl  filled with cracked ice. Stir the custard until cool."", ""Pour the cooled custard on  top of the crumbled cake and macaroons, filling the bowl to within 3/4 inch of  the top."", ""Chill, covered, for at least 6 hours."", ""Beat the whipping cream with  sugar and brandy until it holds stiff peaks."", ""Place in a pastry bag fitted with a  fluted tip and pipe the whipped cream over the edges of the cake sandwiches.  Pipe a large rosette in the centre of the custard."", 
""Decorate the trifle with the  cherries and angelica leaves. Sprinkle with almonds and serve."")"
3700,Plum Pudding,1796,Frank Butcher,,PT0S,PT0S,1999-11-10T01:13:00Z,Make and share this Plum Pudding recipe from Food.com.,character(0),Dessert,"""< 15 Mins""","c(""1"", ""1"", ""1/4"", ""2 1/2"", ""2"", ""1"", ""1"", ""1"", ""1"", ""1/4"", ""1"", ""2"", ""1"", ""1/4"", ""2"", NA)","c(""seedless raisin"", ""dried currant"", ""beef suet"", ""flour"", ""brown sugar"", ""clove"", ""cinnamon"", ""nutmeg"", ""salt"", ""lemon, rind of"", ""eggs"", ""brandy"", ""brandy"")",,,8673.4,594.2,329.8,967,1093.7,734.2,26.2,488.4,64.5,1,,"c(""In a deep mixing bowl combine the raisins, currants, candied fruit peel, beef  suet, flour, brown sugar, spices, salt and lemon rind."", ""Blend the ingredients  thoroughly."", ""In another bowl beat the eggs with the cream and brandy."", ""Pout over  the dried fruit mixture and blend well."", ""Cover the bowl and let stand i n a cool  place for 12 hours."", ""Transfer to a large pudding mould."", ""Cover tightly with waxed paper and foil."", ""Place in a deep pan."", ""Add enough boiling water to reach 1/3 the  way up the side of the mould."", 
""Cover the pan and steam for 4-1/2 hours, adding  more water as necessary."", ""When cooked, remove from the water and let stand until  cooled."", ""Cover with fresh waxed paper and foil."", ""Refrigerate for 2 weeks for best  flavour."", ""To serve the pudding, steam a second time for 2 hours."", ""Turn the pudding onto a  heated serving plate. Pour on the hot brandy and light. Serve with whipped  cream."", ""Flaming Christmas Pudding To achieve the flaming pudding effect: Take a large heavy metal spoon and pour  full of brandy."", 
""Warm the spoon over a flame (candle or low gas flame) or stove  element, until hot. Promptly pour brandy over pudding, strike a match and touch  the surface of the pudding with it. Bring the pudding to the table. Let the  flame burn out on its own."", ""(Have someone dim the lights before the \""en trance\"" of the pudding.) The flame will not last long, unless you have one whacking great  spoonful of hot brandy."", ""For Safety: Ensure that you do not have any paper decorations hanging enroute to the dining room.""
)"
3701,Old Country Chicken Burgers,1533,Dancer,PT9M,PT10M,PT19M,1999-10-26T07:01:00Z,Make and share this Old Country Chicken Burgers recipe from Food.com.,character(0),Chicken,"c(""Poultry"", ""Meat"", ""Very Low Carbs"", ""High Protein"", ""High In..."", ""< 30 Mins"")","c(""1"", ""1"", ""2"", ""1/4"", ""1/4"", ""1/2"", ""1/2"", ""1/2"", ""1/4"")","c(""chicken"", ""prepared mustard"", ""beer"", ""muenster cheese"", ""caraway seed"", ""garlic powder"", ""salt"", ""pepper"")",4,2,287.2,19.5,6.3,91.8,481,2.8,0.5,0.3,23.4,4,,"c(""Combine all ingredients in a large bowl and mix well."", ""Shape into 4 patties."", ""Barbecue with the lid up, over medium heat for 7-9 minutes per side or until pink colour disappears."", ""Serve on dark rye or pumpernickel bread or bagels."", ""Top with sauerkraut and more Muenster cheese."")"
3702,Northwest Mushroom Soup,1533,Dancer,,PT0S,PT0S,1999-10-26T22:15:00Z,Make and share this Northwest Mushroom Soup recipe from Food.com.,character(0),< 15 Mins,,"c(""4"", ""3"", ""1"", ""2"", ""4"", ""2"", ""2"", NA, NA, NA, NA, ""2"", ""1"", ""1/2"", ""1"", ""1"", ""3"", ""2"", ""1/4"")","c(""button mushrooms"", ""carrots"", ""celery"", ""potatoes"", ""garlic"", ""thyme"", ""parsley stems"", ""bay leaf"", ""peppercorn"", ""white wine"", ""heavy cream"", ""lemon"", ""shiitake mushroom"", ""shallots"", ""olive oil"", ""fresh herb"")",5,3,282,13.1,5.8,34.4,380.9,24.5,3.1,8.8,12.3,12,,"c(""Clean and destem mushrooms and process in a food processor until finely chopped."", ""In a saucepan over medium heat, sweat the mushrooms until moisture is released."", ""This will take a good 20 minutes."", ""Make sure to stir often so not to burn."", ""Once the mushrooms are dry, deglaze the pan with the white wine and let reduce until dry."", ""Reserve one half of the cooked mushrooms."", ""Add the mirepoix (onions, celery, carrot) and let cook until slightly caramelized."", ""Add the chicken stock and sachet, bring to a boil and let simmer for approximately 30 minutes."", 
""In a blender puree mixture in small amounts until incorporated and smooth."", ""Once all liquid has been pureed, add the reserved mushrooms."", ""Heat the heavy cream and whisk into mushroom base to desired consistency."", ""Chicken stock can be substituted for cream if preferred."", ""Season with salt, pepper and lemon juice."", ""Saute mushrooms in olive over medium heat. When mushrooms are soft, toss in the shallots and fresh herbs."", ""Season with salt and pepper."", ""To serve, ladle a generous cup of soup into bowls."", 
""Garnish with a heaping spoonful of the mushroom mixture in the center of the bowl."")"
3704,Tuna Steaks,1534,Tonkcats,,PT0S,PT0S,1999-11-10T01:13:00Z,Make and share this Tuna Steaks recipe from Food.com.,"""https://img.sndimg.com/food/image/upload/w_555,h_416,c_fit,fl_progressive,q_95/v1/img/recipes/37/04/picmcgY8H.jpg""",Tuna,"""< 15 Mins""","c(""4"", NA, NA, ""3"", ""2"", ""2"")","c(""tuna steaks"", ""flour"", ""butter"", ""lemons"")",4.5,8,93,8.8,5.5,22.9,63.2,7.8,2.6,0.6,0.8,4,,"c(""Dredge tuna in flour, salt and pepper."", ""Melt butter in a  heavy skillet and cook the tuna until lightly browned on both  sides."", ""Add lemon juice and cook a minute or two longer."", ""Garnish with lemon wedges."")"
3705,Fresh Tuna Tarragon,1534,Tonkcats,,PT0S,PT0S,1999-11-10T01:13:00Z,Make and share this Fresh Tuna Tarragon recipe from Food.com.,character(0),Tuna,"c(""Very Low Carbs"", ""High Protein"", ""High In..."", ""< 15 Mins"")","c(""2"", ""1 1/2"", ""1"", NA, NA, ""1/4"")","c(""tuna steaks"", ""white wine"", ""dried tarragon"", ""all-purpose flour"", ""salt"")",,,523.8,24.8,4.6,86.2,93.6,2.9,0.1,0.8,53.2,,,"c(""M arinate tuna steaks in white wine to cover for 2 hours."", ""Drain."", ""To the marinade, add tarragon and let soak."", ""Dry steaks; dust lightly with flour."", ""Sprinkle salt on and saute in oil on both sides until brown."", ""Add the wine-tarragon mixture; cook at high heat. Remove fish to a hot platter."", ""Pour sauce over and serve at once. Serves 4 to 6."")"
3706,Candy Corn,1534,Tonkcats,,PT0S,PT0S,1999-10-28T18:01:00Z,Make and share this Candy Corn recipe from Food.com.,"c(""https://img.sndimg.com/food/image/upload/w_555,h_416,c_fit,fl_progressive,q_95/v1/img/recipes/37/06/MBPlNk1TRwO6CL8YGXfb_candy%20corn.JPG"", ""https://img.sndimg.com/food/image/upload/w_555,h_416,c_fit,fl_progressive,q_95/v1/img/recipes/37/06/34Abg5CUTkuIA79O8VM5_candy%20corn.JPG"", ""https://img.sndimg.com/food/image/upload/w_555,h_416,c_fit,fl_progressive,q_95/v1/img/recipes/37/06/LlaWtUsQC2zlbVX1oLcg_candy%20corn.JPG"", ""https://img.sndimg.com/food/image/upload/w_555,h_416,c_fit,fl_progressive,q_95/v1/img/recipes/37/06/pic7gHPGB.jpg"", 
""https://img.sndimg.com/food/image/upload/w_555,h_416,c_fit,fl_progressive,q_95/v1/img/recipes/37/06/picXKWPMi.jpg"")",Candy,"c(""Dessert"", ""Low Protein"", ""Healthy"", ""< 15 Mins"")","c(""1"", ""2/3"", ""1/3"", ""1"", NA, ""2 1/2"", ""1/4"", ""1/3"")","c(""sugar"", ""white corn syrup"", ""butter"", ""vanilla"", ""powdered sugar"", ""salt"", ""powdered milk"")",4.5,7,1916,41.8,26.3,116.5,816.7,395.2,0,326.4,6.8,,1 3/4 lbs candy,"c(""Combine sugar, white corn syrup and butter in pan, bring to boil stirring  CONSTANTLY."", ""Turn heat low and boil 5 minutes."", ""Stir occasionally."", ""Remove from  heat and add vanilla and several drops food coloring (optional) Meanwhile, combine powdered sugar, salt  and powdered milk Add all at once to mixture in pan."", ""Stir until cool enough to  handle. Knead until stiff enough to hold its shape. Shape into triangles, or any shape desired."", ""Makes 1 3/4 lb candy."")"
3707,Caribbean Curry,1743,Robin Cowdrey,,PT0S,PT0S,1999-10-28T17:53:00Z,"a yellow curry that you would use to make Chicken Roti or something similar, light and saucy with or without vegies or potatoes.",character(0),Caribbean,"""< 15 Mins""","c(""3"", ""2"", ""1"", ""2"", ""3"", ""2"", ""1"", NA, ""1"", ""1"", ""1"", ""1"", ""1"", ""1"", ""2"", ""1/4"", NA, ""1"", ""1"", ""1/2"", ""1"", ""1"", NA)","c(""boneless skinless chicken breasts"", ""onion"", ""garlic"", ""curry powder"", ""water"", ""tomato paste"", ""chickpeas"", ""onion"", ""garlic"", ""curry powder"", ""tomato paste"", ""water"", ""green onion"", ""fresh spinach"", ""onion"", ""garlic"", ""tomatoes"")",4,3,250.3,8.4,1.4,72.6,305.9,15.7,3.9,1.7,27.9,12,,"c(""Make one or all three of the fillings below to enclose in a soft roti envelope."", ""Curried Chicken Filling: Cut chicken into bite-size pieces; set aside."", ""In skillet, heat oil over medium heat; cook onion, stirring, for 2 minutes. Add garlic; cook, stirring, for 1 minute. Add curry powder; cook, stirring, for 2 minutes."", ""Add 1/2 cup of the water and the tomato paste; cook, sti rring occasionally, for 2 minutes. Add chicken; cover and cook for 10 minutes."", ""Pour in remaining water; simmer for 10 to 15 minutes or until chicken is no longer pink inside. Drain off excess liquid.  Season with salt and pepper to taste."", 
""Curried Chick-Pea Filling: Drain and rinse chick-peas; set aside. In skillet, heat oil over medium heat; cook onion, stirring, for 1 minute. Add garlic; cook, stirring, for 1 minute. Add curry powder; cook for 1 minute. Stir in tomato paste and 1/4 cup of the water; cook for 2 minutes."", ""Add chick-peas, green onions and remaining water; bring to boil."", ""Reduce heat and simmer for 5 minutes or until chick-peas are softened."", ""Season with salt and pepper to taste. Spinach Filling: Trim, wash and coarsely chop spinach; set aside. In skillet, heat oil over medium heat; cook onion, stirring, for 2 minutes."", 
""Add garlic; cook, stirring, for 1 minute. Add spinach; cook, stirring, just until wilted."", ""Stir in tomato, and salt and pepper to taste; cook for 1 minute."")"
3708,Roquefort Dressing,1799,Marian Allen,,PT10M,PT10M,1999-10-28T17:59:00Z,Make and share this Roquefort Dressing recipe from Food.com.,character(0),< 15 Mins,"""Easy""","c(""1"", ""2"", ""2"", ""1/2"", NA, ""1/2"")","c(""sour cream"", ""mayonnaise"", ""lemon juice"", ""Roquefort cheese"")",4.5,4,56.8,5.7,3.3,14.9,23.1,1.2,0,1.1,0.6,8,,"c(""Stir sour cream with mayonnaise, lemon juice and Roquefort cheese."", ""Add onion salt, then salt and pepper to taste"", ""Chill well overnight."")"
3709,Summer Squash Soup,1534,Tonkcats,,PT0S,PT0S,1999-10-28T18:04:00Z,Make and share this Summer Squash Soup recipe from Food.com.,character(0),Low Protein,"c(""Low Cholesterol"", ""Healthy"", ""Summer"", ""< 15 Mins"")","c(""1"", ""2"", ""2"", ""2"", ""1/8"", NA, ""1/4"", ""2"")","c(""zucchini"", ""water"", ""chicken bouillon cubes"", ""onions"", ""fresh ground pepper"", ""plain yogurt"", ""plain yogurt"")",5,18,57.3,1.5,0.7,3.4,738.8,9.2,1.7,5.9,2.9,,4 cups,"c(""Combine water, bouillon cubes, zucchini or yellow squash and onions in medium saucepan. Bring to a boil."", ""Cover, reduce heat and simmer 10 to 15 minutes."", ""Add hot sauce and pepper."", ""Spoon squash mixture into the container of an electric blender."", ""Add yogurt. Process until smooth."", ""Serve hot or cold."", ""May be frozen."")"
3710,Low-Fat Fitness Energy Bars,1533,Dancer,,PT0S,PT0S,1999-10-28T17:51:00Z,"OHHH my, I made these and they taste so good, You feel like you're cheating. Estimated cost is $8.50 for a months supply.  Compare to store bought you will be very surprised at the savings.",character(0),Bar Cookie,"c(""Dessert"", ""Cookie & Brownie"", ""< 15 Mins"", ""Oven"")","c(""1 1/2"", ""1"", ""1/4"", ""1 1/2"", ""1 1/2"", ""1/2"", ""1/2"", ""1"", ""1/2"", ""1/2"", ""1 1/2"", ""1/2"")","c(""rolled oats"", ""sesame seeds"", ""raisins"", ""currants"", ""toasted wheat germ"", ""light corn syrup"", ""granulated sugar"", ""vanilla extract"", ""cinnamon"")",5,5,84.2,1.1,0.2,0,2.2,18.1,1.6,11.3,1.7,,30 bars,"c(""Preheat oven to 350 degrees."", ""Spread oats, cereal and sesame seeds in a 13\"" x 9\""  nonstick jelly roll pan."", ""Bake, stirring occasionally, until oats are toasted,  about 15 minutes."", ""Meanwhile, chop apricots (use the food processor); transfer to a large bowl."", ""Add raisins, protein powder and wheat germ; toss with hands to  mix."", ""Lightly coat jelly roll pan with cooking spray."", ""In a heavy saucepan over  medium-high heat, combine rice syrup and sugar; bring to  a boil."", ""Reduce heat to  low, stir in peanut butter, vanilla and cinnamon."", 
""Quickly pour syrup over  oatmeal mixture and stir well."", ""With wet hands or spatula, immediately spread  warm mixture into the jelly roll pan, pressing into a thin, even layer."", ""(Caution, if you work too slowly, the mixture will harden and be difficult to  spread). Chill until firm, at least four hours."", ""Cut into 2\"" x 3\"" bars."", ""Bars can  be wrapped individu ally in wax paper or foil, or stored in an airtight container with waxed paper between layers."", ""They can be refrigerated for up to four weeks,  or frozen for longer storage.""
)"
3711,Italian Wedding Cookies,1534,Tonkcats,PT15M,PT0S,PT15M,1999-11-10T01:13:00Z,"Also sometimes called 'Mexican wedding cookie', 'Russian tea cakes', or 'butterballs', can also be shaped into crescents. You can also substitute pecans and they are very good as well. This is the best version of these I have ever seen, it was given me by a friend who grew up in central Europe.","c(""https://img.sndimg.com/food/image/upload/w_555,h_416,c_fit,fl_progressive,q_95/v1/img/recipes/37/11/picVygNZA.jpg"", ""https://img.sndimg.com/food/image/upload/w_555,h_416,c_fit,fl_progressive,q_95/v1/img/recipes/37/11/picHXyc4s.jpg"")",Dessert,"c(""Cookie & Brownie"", ""European"", ""< 15 Mins"", ""Oven"")","c(""1 1/2"", ""3/4"", ""3/4"", ""1 1/2"", ""1"", ""3"", NA)","c(""butter"", ""margarine"", ""confectioners' sugar"", ""salt"", ""vanilla"", ""all-purpose flour"", ""confectioners' sugar"")",5,15,67.8,4.8,2.3,9.2,61.1,5.3,0.4,1.3,1.1,,80 cookies,"c(""Preheat oven to 325°F (165°C)."", ""Cream butter or margarine in a bowl, gradually add confectioners' sugar and salt. Beat until light and fluffy."", ""Add almonds and vanilla."", ""Blend in flour gradually and mix well."", ""Shape into balls (or crescents) using about 1 teaspoon for each cookie."", ""Place on ungreased cookie sheets, and bake for 15-20 minutes.  Do not brown."", ""Cool slightly, then roll in the extra confectioners' sugar."")"
3712,Italian Wedding Cookies II,1534,Tonkcats,PT12M,PT0S,PT12M,1999-11-10T01:13:00Z,This recipe is an old time favorite of ours. All the kids love these and  so do we! Hope you get all the nice compliments as I do when you make them.,character(0),Dessert,"c(""Cookie & Brownie"", ""European"", ""< 15 Mins"", ""Oven"")","c(""8"", ""1 1/2"", ""1"", ""4"", ""1"", ""2"", ""1/4"", ""1"", ""1"", NA)","c(""almond paste"", ""butter"", ""white sugar"", ""eggs"", ""all-purpose flour"", ""salt"")",5,2,228.7,12.6,6.7,44.1,82.5,26.8,1.2,17.6,2.5,,36 cookies,"c(""Preheat oven to 350°F (175°C)."", ""In a large bowl break up the almond paste. Add the softened butter,  sugar, eggs and almond extract. Beat batter until light and fluffy."", ""Beat in  the flour and the salt. Split the batter into thirds and add enough of the  three different food colorings to each third to color the batter nicely."", ""Spread the batters into three 9 x 13 and 1/4-inch deep aluminum baking pans. Be  sure the batter is only about 1/8-inch thick or it will rise to high."", ""Bake at 350°F (175°C) for 12 minutes."", 
""Cool. Remove baked and cooled cakes from pans and place on a cookie sheet or  cutting board."", ""Heat the jam and spread between the layers as you stack them."", ""Spread the melted chocolate over the top layer and refrigerate. When stiff remove cookies from the refrigerator and let chocolate soften slightly before cutting into small rectangles."")"
3713,Hot Mulled Apple Cider,1534,Tonkcats,PT20M,PT5M,PT25M,1999-10-28T18:06:00Z,Make and share this Hot Mulled Apple Cider recipe from Food.com.,"c(""https://img.sndimg.com/food/image/upload/w_555,h_416,c_fit,fl_progressive,q_95/v1/img/recipes/37/13/picYWlZBm.jpg"", ""https://img.sndimg.com/food/image/upload/w_555,h_416,c_fit,fl_progressive,q_95/v1/img/recipes/37/13/picWKGhAQ.jpg"")",Beverages,"c(""Apple"", ""Fruit"", ""Low Protein"", ""Low Cholesterol"", ""Healthy"", ""Winter"", ""< 30 Mins"")","c(""1/2"", ""1"", ""1"", ""1/4"", ""1"", ""3"", ""2"", NA, ""1"")","c(""brown sugar"", ""whole allspice"", ""whole cloves"", ""salt"", ""nutmeg"", ""cinnamon sticks"", ""apple cider"", ""whole cloves"")",5,29,57,0.1,0,0,111.6,14.7,0.2,13.4,0.1,8,8 cups,"c(""Combine brown sugar, allspice, 1 teaspoon cloves, salt, nutmeg, cinnamon and apple cider in large saucepan."", ""Bring to boiling."", ""Cover and simmer for 20 minutes."", ""Strain to remove spices."", ""Serve in mugs with clove-studded orange wedges."")"
